{
  "statistics": {
    "total_sms": 5072,
    "financial_sms_count": 1439,
    "excluded_sms_count": 3633,
    "financial_percentage": 28.37,
    "exclusion_breakdown": {
      "government_info": 57,
      "otp": 531,
      "promotional": 547,
      "shopping_non_payment": 183,
      "social": 341,
      "other": 1835,
      "system": 104,
      "payment_requests": 34,
      "data_usage": 1
    },
    "processing_timestamp": "2025-08-12T16:51:53.592730"
  },
  "financial_sms": [
    {
      "sender": "VK-SBIUPI-S",
      "body": "Dear UPI user A/C X9855 debited by 83.0 on date 26Jul25 trf to Pluto Money Refno 520756016992. If not u? call 1800111109. -SBI",
      "date": "2025-07-26T15:01:39.612",
      "type": "SmsMessageKind.received"
    },
    {
      "sender": "VK-SBIUPI-S",
      "body": "Your UPI-Mandate for Rs.83.00 is successfully created towards Pluto Money from A/c No: XXXXXX9855. UMN:a773cff41c314757bac8462847b883c6@ibl. If not you, kindly report on 18001234. -SBI",
      "date": "2025-07-26T15:01:37.592",
      "type": "SmsMessageKind.received"
    },
    {
      "sender": "VM-SBIUPI-S",
      "body": "Dear UPI user A/C X9855 debited by 20.0 on date 26Jul25 trf to BMTC BUS KA57F22 Refno 498037138430. If not u? call 1800111109. -SBI",
      "date": "2025-07-26T13:46:22.338",
      "type": "SmsMessageKind.received"
    },
    {
      "sender": "JK-NSESMS-S",
      "body": "SBICAP SECURITIES LIMITED on 19-07-25 reported your Fund bal Rs.0 & Securities bal 0. This excludes your Bank, DP & PMS bal with the broker-NSE",
      "date": "2025-07-25T20:23:08.562",
      "type": "SmsMessageKind.received"
    },
    {
      "sender": "AD-SBIUPI-S",
      "body": "Your UPI-Mandate for Rs.81.00 is successfully created towards Pluto Money from A/c No: XXXXXX9855. UMN:b97cbebadabc49dbb19bb655dfc5cf6c@ibl. If not you, kindly report on 18001234. -SBI",
      "date": "2025-07-25T20:20:46.898",
      "type": "SmsMessageKind.received"
    },
    {
      "sender": "VK-SBIUPI-S",
      "body": "Dear UPI user A/C X9855 debited by 17.0 on date 25Jul25 trf to RIAZ PASHA SHAIK Refno 613384605625. If not u? call 1800111109. -SBI",
      "date": "2025-07-25T17:24:43.141",
      "type": "SmsMessageKind.received"
    },
    {
      "sender": "VK-SBIUPI-S",
      "body": "Dear UPI user A/C X9855 debited by 150.0 on date 25Jul25 trf to HALLI MANE DONNE Refno 277511609196. If not u? call 1800111109. -SBI",
      "date": "2025-07-25T14:16:54.447",
      "type": "SmsMessageKind.received"
    },
    {
      "sender": "AX-650024-P",
      "body": "IND vs ENG sorted with Airtel!\nWatch every match LIVE on JioHotstar, available with pack at Rs279.\nSubscribe now- open.airtelxstream.in/AllOTTS",
      "date": "2025-07-25T12:12:25.619",
      "type": "SmsMessageKind.received"
    },
    {
      "sender": "AX-SBIUPI-S",
      "body": "Your UPI-Mandate for Rs.78.00 is successfully created towards Pluto Money from A/c No: XXXXXX9855. UMN:291bb364cbbc446c9600ec3cd2417a0d@ibl. If not you, kindly report on 18001234. -SBI",
      "date": "2025-07-24T21:29:16.007",
      "type": "SmsMessageKind.received"
    },
    {
      "sender": "AX-SBIUPI-S",
      "body": "Dear UPI user A/C X9855 debited by 150.0 on date 24Jul25 trf to HALLI MANE DONNE Refno 447965688556. If not u? call 1800111109. -SBI",
      "date": "2025-07-24T14:07:02.449",
      "type": "SmsMessageKind.received"
    },
    {
      "sender": "AX-CBSSBI-S",
      "body": "Dear Customer, Your A/C XXXXX304600 has a debit by transfer of Rs 9,060.00 on 23/07/25. Avl Bal Rs 0.00.-SBI",
      "date": "2025-07-23T22:20:34.551",
      "type": "SmsMessageKind.received"
    },
    {
      "sender": "AX-CBSSBI-S",
      "body": "Dear Customer, Your A/C XXXXX869855 Credited. INR 9,060.00 on 23/07/25 on account of Closure of TD A/c XXXXX304600.-SBI",
      "date": "2025-07-23T22:20:26.277",
      "type": "SmsMessageKind.received"
    },
    {
      "sender": "AD-SBYONO-S",
      "body": "Dear Customer, You have entered incorrect MPIN twice and are left with 1 more attempt. Team YONO SBI",
      "date": "2025-07-23T22:19:01.830",
      "type": "SmsMessageKind.received"
    },
    {
      "sender": "AD-SBYONO-S",
      "body": "Dear Customer, You have entered incorrect MPIN for first time and are left with 2 more attempts. Team YONO SBI",
      "date": "2025-07-23T22:18:38.041",
      "type": "SmsMessageKind.received"
    },
    {
      "sender": "JD-SBIUPI-S",
      "body": "Dear UPI user A/C X9855 debited by 45.0 on date 21Jul25 trf to GITARTHA  KASHYA Refno 397766497164. If not u? call 1800111109. -SBI",
      "date": "2025-07-21T20:11:36.542",
      "type": "SmsMessageKind.received"
    },
    {
      "sender": "AX-BIGBKT-S",
      "body": "Dear Divyam,\nPayment for your bbnow Order #1744180708 has failed. Kindly retry the payment for your order to be processed.\n\nRegards,\nTeam bigbasket",
      "date": "2025-07-21T00:05:36.219",
      "type": "SmsMessageKind.received"
    },
    {
      "sender": "VA-SBIUPI-S",
      "body": "Dear UPI user A/C X9855 debited by 29.0 on date 20Jul25 trf to Nandini Refno 142389379317. If not u? call 1800111109. -SBI",
      "date": "2025-07-20T21:02:17.835",
      "type": "SmsMessageKind.received"
    },
    {
      "sender": "AX-AIRTEL-P",
      "body": "Up to Rs. 300 reward for every referral. Share now via Airtel Thanks App https://i.airtel.in/3_refer300",
      "date": "2025-07-20T17:20:19.545",
      "type": "SmsMessageKind.received"
    },
    {
      "sender": "57575711",
      "body": "Your Apple Account code is: 443875. Do not share it with anyone.",
      "date": "2025-07-20T03:42:12.513",
      "type": "SmsMessageKind.received"
    },
    {
      "sender": "AX-SBYONO-S",
      "body": "Dear Customer, YONO SBI app successfully enabled for mobile banking. If not done by you please call us on 1800111109. Never share your ID or Password to anyone and never click on any link shared with you.",
      "date": "2025-07-18T22:57:08.846",
      "type": "SmsMessageKind.received"
    },
    {
      "sender": "AD-SBYONO-S",
      "body": "Alert: Dear Customer, you have successfully set your MPIN for YONO SBI mobile banking app. If not done by you please call us on 1800111109.",
      "date": "2025-07-18T22:57:08.266",
      "type": "SmsMessageKind.received"
    },
    {
      "sender": "VM-SBIUPI-S",
      "body": "Dear UPI user A/C X9855 debited by 74.0 on date 16Jul25 trf to GITARTHA  KASHYA Refno 842795771884. If not u? call 1800111109. -SBI",
      "date": "2025-07-16T22:41:45.085",
      "type": "SmsMessageKind.received"
    },
    {
      "sender": "JD-SBIUPI-S",
      "body": "Dear UPI user A/C X9855 debited by 342.0 on date 16Jul25 trf to Blinkit Refno 137950941427. If not u? call 1800111109. -SBI",
      "date": "2025-07-16T22:04:12.904",
      "type": "SmsMessageKind.received"
    },
    {
      "sender": "JD-DLHVRY-S",
      "body": "Delivered: Your Delhivery Direct order with AWB 2827767593734 was successfully delivered on 2025-07-16. -Delhivery",
      "date": "2025-07-16T16:52:34.734",
      "type": "SmsMessageKind.received"
    },
    {
      "sender": "VA-SBIUPI-S",
      "body": "Dear UPI user A/C X9855 debited by 60.0 on date 14Jul25 trf to ALI HASSAN CHALI Refno 056534768456. If not u? call 1800111109. -SBI",
      "date": "2025-07-14T16:57:01.596",
      "type": "SmsMessageKind.received"
    },
    {
      "sender": "VA-DOTKEY-P",
      "body": "Buy 2 @ Rs.699 on Watermelon Sunscreen   Icy Gel Moisturizer\n\nStock up on Oily Skin must-haves now!\n\nhttps://weurl.co/DOTKEY/HTNj6T - Dot & Key",
      "date": "2025-07-12T10:39:16.136",
      "type": "SmsMessageKind.received"
    },
    {
      "sender": "JK-SBIUPI-S",
      "body": "Dear UPI user A/C X9855 debited by 367.0 on date 11Jul25 trf to GITARTHA  KASHYA Refno 700602916258. If not u? call 1800111109. -SBI",
      "date": "2025-07-11T22:04:08.956",
      "type": "SmsMessageKind.received"
    },
    {
      "sender": "VM-MYTNEU-S",
      "body": "Hi, you've used 9.45 NeuCoin(s) at bigbasket on 11-07-2025. Check your NeuCoins balance at http://m.tneu.in/MYTNEU/LRDzlqA - Team TataNeu",
      "date": "2025-07-11T21:15:58.249",
      "type": "SmsMessageKind.received"
    },
    {
      "sender": "JK-SBIUPI-S",
      "body": "Dear UPI user A/C X9855 debited by 10.0 on date 09Jul25 trf to KARNATAKA STORE Refno 361293776797. If not u? call 1800111109. -SBI",
      "date": "2025-07-09T17:39:47.755",
      "type": "SmsMessageKind.received"
    },
    {
      "sender": "AD-AIRBIL-S",
      "body": "\nHi Divyam, Bill for your Airtel Wi-Fi 20029509908 dated 09-Jul-2025 has been generated and there is no payable amount.\n\nTo view your bill, please visit https://i.airtel.in/BBBillbreakup\n",
      "date": "2025-07-09T06:13:27.746",
      "type": "SmsMessageKind.received"
    },
    {
      "sender": "VM-PVRVIP-P",
      "body": "The Tuesday countdown has begun! F1, Jurassic World, Metro In Dino & more blockbusters starts at just INR 99. Book now @ PVR https://pvr.im/PVRVIP/AwaF3PUb",
      "date": "2025-07-08T14:54:21.966",
      "type": "SmsMessageKind.received"
    },
    {
      "sender": "JM-NSESMS-S",
      "body": "SBICAP SECURITIES LIMITED on 28-06-25 reported your Fund bal Rs.0 & Securities bal 0. This excludes your Bank, DP & PMS bal with the broker-NSE",
      "date": "2025-07-07T08:20:22.671",
      "type": "SmsMessageKind.received"
    },
    {
      "sender": "VM-SBIUPI-S",
      "body": "Dear UPI user A/C X9855 debited by 190.0 on date 05Jul25 trf to M/S.MONAMI HOSPI Refno 951393128122. If not u? call 1800111109. -SBI",
      "date": "2025-07-05T14:13:58.557",
      "type": "SmsMessageKind.received"
    },
    {
      "sender": "CP-QNTAMC-S",
      "body": "Dear Investor,Your purchase request Dt 03/07/2025 for Rs. 2499.88 in scheme quant Mid Cap Fund - Direct Plan is processed @ NAV of Rs. 248.6183 and 10.055 units are allotted in Folio: XXXXXXXX854 . Rgds, quant Mutual Fund.",
      "date": "2025-07-04T09:03:02.861",
      "type": "SmsMessageKind.received"
    },
    {
      "sender": "JD-SBIUPI-S",
      "body": "Dear UPI user A/C X9855 debited by 44.0 on date 03Jul25 trf to MIDAS DAILY SUPE Refno 565625035570. If not u? call 1800111109. -SBI",
      "date": "2025-07-03T21:55:26.348",
      "type": "SmsMessageKind.received"
    },
    {
      "sender": "CP-QNTAMC-S",
      "body": "Dear Investor,Your purchase request Dt 02/07/2025 for Rs. 4999.75 in scheme quant Small Cap Fund - Direct Plan Growth is processed @ NAV of Rs. 283.4019 and 17.642 units are allotted in Folio: XXXXXXXX854 . Rgds, quant Mutual Fund.",
      "date": "2025-07-03T09:13:45.067",
      "type": "SmsMessageKind.received"
    },
    {
      "sender": "AX-ATMSBI-S",
      "body": "Dear SBI Customer, Rs.2000 withdrawn at UBI ATM PBGE0110 from A/cX9855 on 02Jul25 Transaction Number 518318029613. Available Balance Rs.24623.62. If not withdrawn by you, forward this SMS to 7400165218 / call 1800111109 or 09449112211 to block your card. Call 18001234 if cash not received.",
      "date": "2025-07-02T18:05:01.274",
      "type": "SmsMessageKind.received"
    },
    {
      "sender": "AX-ATMSBI-S",
      "body": "Dear Customer,you have done 2 out of 5 free transactions at Non-SBI ATM in India this month.Charges applicable beyond free transactions. Kindly use SBI ATM",
      "date": "2025-07-02T18:04:54.169",
      "type": "SmsMessageKind.received"
    },
    {
      "sender": "AX-ATMSBI-S",
      "body": "Dear SBI Customer, Rs.10000 withdrawn at UBI ATM PBGE0110 from A/cX9855 on 02Jul25 Transaction Number 518318029116. Available Balance Rs.26623.62. If not withdrawn by you, forward this SMS to 7400165218 / call 1800111109 or 09449112211 to block your card. Call 18001234 if cash not received.",
      "date": "2025-07-02T18:03:25.287",
      "type": "SmsMessageKind.received"
    },
    {
      "sender": "AX-ATMSBI-S",
      "body": "Dear Customer,you have done 1 out of 5 free transactions at Non-SBI ATM in India this month.Charges applicable beyond free transactions. Kindly use SBI ATM",
      "date": "2025-07-02T18:03:21.052",
      "type": "SmsMessageKind.received"
    },
    {
      "sender": "JX-CULTFT-S",
      "body": "Dear customer, your payment of Rs.16606 for your cult.fit order is awaiting confirmation. Typically, it takes 5-10 minutes. Thank you for your patience!",
      "date": "2025-07-02T11:43:53.194",
      "type": "SmsMessageKind.received"
    },
    {
      "sender": "AX-SBIINB-S",
      "body": "Dear Customer, Your a/c no. XXXXXXXX9855 is credited by Rs.60000.00 on 02-07-25 by a/c linked to mobile 7XXXXXX682-STATION91 TECHNOLOG (IMPS Ref no 518359214156).If not done by you, call 1800111109. -SBI",
      "date": "2025-07-02T09:58:21.194",
      "type": "SmsMessageKind.received"
    },
    {
      "sender": "CP-KFNCRA-S",
      "body": "Value of investments in your PRAN XX1920 Tier -I account as on 30/06/2025 is Rs. 1026.64 respectively. - KFNCRA",
      "date": "2025-07-02T03:41:44.249",
      "type": "SmsMessageKind.received"
    },
    {
      "sender": "JK-SBIUPI-S",
      "body": "Dear UPI user A/C X9855 debited by 20.0 on date 01Jul25 trf to ALUMALAI Refno 821926924505. If not u? call 1800111109. -SBI",
      "date": "2025-07-01T17:26:10.738",
      "type": "SmsMessageKind.received"
    },
    {
      "sender": "JD-SBIUPI-S",
      "body": "Dear UPI user A/C X9855 debited by 410.0 on date 28Jun25 trf to TOKALEV FOODS LL Refno 368543492947. If not u? call 1800111109. -SBI",
      "date": "2025-06-28T18:21:18.882",
      "type": "SmsMessageKind.received"
    },
    {
      "sender": "JD-SBIUPI-S",
      "body": "Dear UPI user A/C X9855 debited by 297.0 on date 28Jun25 trf to LOKESH  G Refno 950499597392. If not u? call 1800111109. -SBI",
      "date": "2025-06-28T16:34:47.104",
      "type": "SmsMessageKind.received"
    },
    {
      "sender": "VM-ITDCPC-G",
      "body": "Dear SHRIRAM GUPTA, ITR:1 of 2025  for AQXXXXXX4L  has been successfully e-Verified. e-Filing, Income Tax Department",
      "date": "2025-06-28T14:53:47.403",
      "type": "SmsMessageKind.received"
    },
    {
      "sender": "JD-SBIUPI-S",
      "body": "Dear UPI user A/C X9855 debited by 342.0 on date 27Jun25 trf to Life Lines Tende Refno 274902809386. If not u? call 1800111109. -SBI",
      "date": "2025-06-27T19:52:06.074",
      "type": "SmsMessageKind.received"
    },
    {
      "sender": "JZ-JIONET-S",
      "body": "Dear Customer, \nService request no SR00002GBE0N has been raised in your account. \nYou will receive an update for this request by 2025-06-25T17:11:46. \nTo track the status of your service requests at your convenience, please visit MyJio App - https://www.jio.com/dl/track_sr_status",
      "date": "2025-06-24T17:11:57.750",
      "type": "SmsMessageKind.received"
    },
    {
      "sender": "AD-SBIUPI-S",
      "body": "Dear User UPI LITE Top-up on SBI Rs.500.00 is successful. Ref No 229850460998. If not done by u, call 18001234 -SBI",
      "date": "2025-06-22T20:53:15.353",
      "type": "SmsMessageKind.received"
    },
    {
      "sender": "AD-SBIUPI-S",
      "body": "Dear User UPI LITE Top-up on SBI Rs.1000.00 is successful. Ref No 629615216547. If not done by u, call 18001234 -SBI",
      "date": "2025-06-22T19:43:56.626",
      "type": "SmsMessageKind.received"
    },
    {
      "sender": "JK-JIONET-S",
      "body": "Dear Customer, \nService request no SR00002G4RVJ has been raised in your account. \nYou will receive an update for this request by 2025-06-29T16:09:44. \nTo track the status of your service requests at your convenience, please visit MyJio App - https://www.jio.com/dl/track_sr_status",
      "date": "2025-06-22T16:10:11.397",
      "type": "SmsMessageKind.received"
    },
    {
      "sender": "AX-SBIUPI-S",
      "body": "Dear User UPI LITE Top-up on SBI Rs.900.00 is successful. Ref No 439241999854. If not done by u, call 18001234 -SBI",
      "date": "2025-06-21T21:30:29.230",
      "type": "SmsMessageKind.received"
    },
    {
      "sender": "AD-SBIUPI-S",
      "body": "Dear User UPI LITE Top-up on SBI Rs.1000.00 is successful. Ref No 417215550178. If not done by u, call 18001234 -SBI",
      "date": "2025-06-19T00:11:52.535",
      "type": "SmsMessageKind.received"
    },
    {
      "sender": "AD-SBIUPI-S",
      "body": "Dear User UPI LITE Top-up on SBI Rs.1000.00 is failed. Please try again. Ref No 881855297003 -SBI",
      "date": "2025-06-19T00:09:39.449",
      "type": "SmsMessageKind.received"
    },
    {
      "sender": "JK-NSESMS-S",
      "body": "SBICAP SECURITIES LIMITED on 07-06-25 reported your Fund bal Rs.0 & Securities bal 0. This excludes your Bank, DP & PMS bal with the broker-NSE",
      "date": "2025-06-18T19:37:27.938",
      "type": "SmsMessageKind.received"
    },
    {
      "sender": "VM-PVRVIP-P",
      "body": "Blockbuster Tuesday is on! Book Housefull 5, Ballerina, How to Train Your Dragon & more for starts at just INR 99 now at PVR https://pvr.im/PVRVIP/xWwoRcir",
      "date": "2025-06-17T14:43:49.857",
      "type": "SmsMessageKind.received"
    },
    {
      "sender": "JD-SBIUPI-S",
      "body": "Dear UPI user A/C X9855 debited by 470.82 on date 17Jun25 trf to Jio Postpaid Bil Refno 164263330200. If not u? call 1800111109. -SBI",
      "date": "2025-06-17T12:44:43.968",
      "type": "SmsMessageKind.received"
    },
    {
      "sender": "JK-JIONET-S",
      "body": "Dear Customer, \nService request no SR00002FLG55 has been raised in your account. \nYou will receive an update for this request by 2025-06-23T13:24:17. \nTo track the status of your service requests at your convenience, please visit MyJio App - https://www.jio.com/dl/track_sr_status",
      "date": "2025-06-16T13:24:25.927",
      "type": "SmsMessageKind.received"
    },
    {
      "sender": "JD-SBIUPI-S",
      "body": "Dear UPI user A/C X9855 debited by 485.0 on date 16Jun25 trf to PhonePe Refno 722590189753. If not u? call 1800111109. -SBI",
      "date": "2025-06-16T11:13:29.534",
      "type": "SmsMessageKind.received"
    },
    {
      "sender": "JD-SBIUPI-S",
      "body": "Dear UPI user A/C X9855 debited by 30.0 on date 12Jun25 trf to RIAZ PASHA SHAIK Refno 043386617125. If not u? call 1800111109. -SBI",
      "date": "2025-06-12T17:03:51.874",
      "type": "SmsMessageKind.received"
    },
    {
      "sender": "AX-650003-P",
      "body": "Alert for 8881XXX839 !\nRecharge with Rs349 Airtel pack to get UL calls, 2GB data/day, 100 SMS/day & (Sony Liv,Lionsgate,Aha & 20+ OTTs) with Airtel Xstream Play for 28 Days. Recharge on Airtel Thanks App with ZERO CONVENIENCE FEE  i.airtel.in/AirRech",
      "date": "2025-06-12T11:33:33.922",
      "type": "SmsMessageKind.received"
    },
    {
      "sender": "AD-SBIUPI-S",
      "body": "Dear UPI user A/C X9855 debited by 15.0 on date 11Jun25 trf to RIAZ PASHA SHAIK Refno 843397116562. If not u? call 1800111109. -SBI",
      "date": "2025-06-11T19:14:18.138",
      "type": "SmsMessageKind.received"
    },
    {
      "sender": "JD-SBIUPI-S",
      "body": "Dear UPI user A/C X9855 debited by 2500.0 on date 11Jun25 trf to Sonam  Verma Refno 988082808515. If not u? call 1800111109. -SBI",
      "date": "2025-06-11T03:01:06.828",
      "type": "SmsMessageKind.received"
    },
    {
      "sender": "JD-SBIUPI-S",
      "body": "Dear UPI user A/C X9855 debited by 15.0 on date 09Jun25 trf to KA01AR4158 Refno 710181222653. If not u? call 1800111109. -SBI",
      "date": "2025-06-09T10:45:43.449",
      "type": "SmsMessageKind.received"
    },
    {
      "sender": "JX-JIONET-S",
      "body": "Dear Customer, \nService request no SR00002F5MSZ has been raised in your account. \nYou will receive an update for this request by 10/06/2025 10:40. \nTo track the status of your service requests at your convenience, please visit MyJio App - https://www.jio.com/dl/track_sr_status",
      "date": "2025-06-09T10:41:01.159",
      "type": "SmsMessageKind.received"
    },
    {
      "sender": "JK-SBIUPI-S",
      "body": "Dear UPI user A/C X9855 debited by 529.0 on date 07Jun25 trf to LivPure Refno 939659923322. If not u? call 1800111109. -SBI",
      "date": "2025-06-07T14:32:22.357",
      "type": "SmsMessageKind.received"
    },
    {
      "sender": "AD-RECHRG",
      "body": "Congratulations! Extra validity has been added in your account. Now enjoy 1.5GB/day, unlimited calls & 100SMS for 84 days. u.airtel.in/Online_Rch",
      "date": "2025-06-07T14:31:04.390",
      "type": "SmsMessageKind.received"
    },
    {
      "sender": "Airtel-S",
      "body": "Recharge of INR 799.00 is successful for your Airtel Mobile on 07-06-2025 14:30, Transaction ID 1729440775.Check your balance, validity, tariff and best recharges on Airtel Thanks App i.airtel.in/SerAIr . Spam protection is live on your Airtel number.",
      "date": "2025-06-07T14:31:01.884",
      "type": "SmsMessageKind.received"
    },
    {
      "sender": "AX-AIRTEL",
      "body": "Pack Valid till 07 Jun 2025. CallCost:Rs0.00 Duration:00:00:13 Bal:Rs0.00.\nRC379=UL call, 2GB/day,UL 5G, 100 SMS/day, 1 month",
      "date": "2025-06-07T12:59:25.459",
      "type": "SmsMessageKind.received"
    },
    {
      "sender": "AX-650002-P",
      "body": "Your Airtel pack on 8881XXX839 is about to expire!\nRecharge now with Rs859 to stay connected. Get UL calls, 2GB data/day, 100 SMS/day & UL 5G available for 84 days. Recharge on Airtel Thanks App with ZERO CONVENIENCE FEE  i.airtel.in/AirRech",
      "date": "2025-06-07T12:39:28.793",
      "type": "SmsMessageKind.received"
    },
    {
      "sender": "VM-LIVSMT-S",
      "body": "Dear Livpure Smart user. Since your payment is still due. Your supply of pay as you go pure water would have stopped. Please recharge immediately to restart your smart subscription service. - Livpure Smart",
      "date": "2025-06-07T12:16:01.053",
      "type": "SmsMessageKind.received"
    },
    {
      "sender": "AX-AIRTEL",
      "body": "Your Airtel pack ends TOMORROW. If not recharged, outgoing services will stop. Recharge without losing your current validity i.airtel.in/FDPNew Ignore if done",
      "date": "2025-06-06T14:26:17.114",
      "type": "SmsMessageKind.received"
    },
    {
      "sender": "AX-650001-P",
      "body": "Your Airtel pack on 8881XXX839 is about to expire!\nRecharge now with Rs379 to get UL 5G, unlimited calls with 2GB data/day & 100 SMS/day for 1 month. Recharge on Airtel Thanks App with ZERO CONVENIENCE FEE  i.airtel.in/AirRech",
      "date": "2025-06-06T11:59:49.400",
      "type": "SmsMessageKind.received"
    },
    {
      "sender": "AD-QNTAMC-S",
      "body": "Dear Investor,Your purchase request Dt 03/06/2025 for Rs. 3499.83 in scheme quant Small Cap Fund - Direct Plan Growth is processed @ NAV of Rs. 271.5611 and 12.888 units are allotted in Folio: XXXXXXXX854 . Rgds, quant Mutual Fund.",
      "date": "2025-06-06T06:52:51.898",
      "type": "SmsMessageKind.received"
    },
    {
      "sender": "AX-QNTAMC-S",
      "body": "Dear Investor,Your purchase request Dt 03/06/2025 for Rs. 3499.83 in scheme quant Mid Cap Fund - Direct Plan is processed @ NAV of Rs. 242.9149 and 14.408 units are allotted in Folio: XXXXXXXX854 . Rgds, quant Mutual Fund.",
      "date": "2025-06-06T06:43:30.405",
      "type": "SmsMessageKind.received"
    },
    {
      "sender": "AX-650003-P",
      "body": "Your Airtel pack on 8881XXX839 is about to expire!\nRecharge now with Rs299 to stay connected. Get unlimited calls, 1.5GB data/day & 100 SMS/day for 28 days. Recharge on Airtel Thanks App with ZERO CONVENIENCE FEE  i.airtel.in/AirRech",
      "date": "2025-06-05T13:55:33.018",
      "type": "SmsMessageKind.received"
    },
    {
      "sender": "AX-AIRTEL",
      "body": "Airtel Unlimited Pack validity for 8881384839 is till 07-Jun-25. Recharge TODAY without losing your current validity i.airtel.in/FDPNew Ignore if already done",
      "date": "2025-06-05T11:00:35.946",
      "type": "SmsMessageKind.received"
    },
    {
      "sender": "AD-SBIUPI-S",
      "body": "Dear UPI user A/C X9855 debited by 10.0 on date 05Jun25 trf to P NAVEEN Refno 520497509951. If not u? call 1800111109. -SBI",
      "date": "2025-06-05T10:37:56.772",
      "type": "SmsMessageKind.received"
    },
    {
      "sender": "AX-650001-P",
      "body": "Your Airtel pack on 8881XXX839 is about to expire!\nRecharge now with Rs379 to get UL 5G, unlimited calls with 2GB data/day & 100 SMS/day for 1 month. Recharge on Airtel Thanks App with ZERO CONVENIENCE FEE  i.airtel.in/AirRech",
      "date": "2025-06-05T10:15:47.900",
      "type": "SmsMessageKind.received"
    },
    {
      "sender": "JD-KFNCRA-S",
      "body": "Your contribution of Rs.1,000.00 has been credited to your NPS Tier-I a/c on 4-Jun-25 and valuation of your Tier-I a/c is Rs.999.96 - KFNCRA",
      "date": "2025-06-04T22:20:34.154",
      "type": "SmsMessageKind.received"
    },
    {
      "sender": "AX-AIRTEL",
      "body": "Alert 50%: data is consumed. Get 2GB at Rs33 till Midnight. Recharge now i.airtel.in/dtpck",
      "date": "2025-06-04T13:56:16.440",
      "type": "SmsMessageKind.received"
    },
    {
      "sender": "AX-650001-P",
      "body": "Your Airtel pack on 8881XXX839 is about to expire!\nRecharge now with Rs379 to get UL 5G, unlimited calls with 2GB data/day & 100 SMS/day for 1 month. Recharge on Airtel Thanks App with ZERO CONVENIENCE FEE  i.airtel.in/AirRech",
      "date": "2025-06-04T13:06:46.465",
      "type": "SmsMessageKind.received"
    },
    {
      "sender": "JD-KFNCRA-S",
      "body": "Dear Subscriber, We have received fund confirmation of Rs.1000.00 for investment in PRAN XXXX1920 Tier-I. Units will be credited by end of the day. - KFNCRA",
      "date": "2025-06-04T12:56:41.525",
      "type": "SmsMessageKind.received"
    },
    {
      "sender": "AX-AIRTEL",
      "body": "Airtel pack on 8881384839 ends on 07-Jun-25. Recharge today without losing your current validity i.airtel.in/FDPNew Ignore if already done",
      "date": "2025-06-04T10:39:11.172",
      "type": "SmsMessageKind.received"
    },
    {
      "sender": "AX-650003-P",
      "body": "Your Airtel pack on 8881XXX839 is about to expire!\nRecharge now with Rs299 to stay connected. Get unlimited calls, 1.5GB data/day & 100 SMS/day for 28 days. Recharge on Airtel Thanks App with ZERO CONVENIENCE FEE  i.airtel.in/AirRech",
      "date": "2025-06-04T10:22:51.839",
      "type": "SmsMessageKind.received"
    },
    {
      "sender": "AX-AIRTEL",
      "body": "Alert 100%: for your daily high speed data limit. Get 2GB at Rs33 till Midnight. Recharge now i.airtel.in/dtpck",
      "date": "2025-06-03T16:40:34.954",
      "type": "SmsMessageKind.received"
    },
    {
      "sender": "Airtel-S",
      "body": "Enjoy 5GB data valid for 7 days.Also get EXTRA 1GB on your next recharge of Rs77 for your Airtel Mobile, only on Airtel Thanks App. Click i.airtel.in/rech_now",
      "date": "2025-06-03T16:19:47.515",
      "type": "SmsMessageKind.received"
    },
    {
      "sender": "AX-AIRTEL",
      "body": "Alert 90%: data is consumed. Get 2GB at Rs33 till Midnight. Recharge now i.airtel.in/dtpck",
      "date": "2025-06-03T16:14:26.127",
      "type": "SmsMessageKind.received"
    },
    {
      "sender": "AX-AIRTEL",
      "body": "Alert 50%: data is consumed. Get 2GB at Rs33 till Midnight. Recharge now i.airtel.in/dtpck",
      "date": "2025-06-03T14:14:26.554",
      "type": "SmsMessageKind.received"
    },
    {
      "sender": "AD-SBIUPI-S",
      "body": "Dear UPI user A/C X9855 debited by 3500.0 on date 02Jun25 trf to ICCL ZERODHA COI Refno 100680661962. If not u? call 1800111109. -SBI",
      "date": "2025-06-02T22:43:15.780",
      "type": "SmsMessageKind.received"
    },
    {
      "sender": "AX-AIRTEL",
      "body": "Alert 90%: data is consumed. Get 2GB at Rs33 till Midnight. Recharge now i.airtel.in/dtpck",
      "date": "2025-06-02T21:09:36.803",
      "type": "SmsMessageKind.received"
    },
    {
      "sender": "AX-AIRTEL",
      "body": "Alert 50%: data is consumed. Get 2GB at Rs33 till Midnight. Recharge now i.airtel.in/dtpck",
      "date": "2025-06-02T16:05:40.648",
      "type": "SmsMessageKind.received"
    },
    {
      "sender": "JM-axioFS-S",
      "body": "Pay axio Pay Later bill of Rs3741 by 5th of this month: https://u.axio.co/axo/Tz6YtFtvvhvt4B\nBill: https://u.axio.co/axo/9N4ysZSKms4D1\naxio",
      "date": "2025-06-02T15:14:03.436",
      "type": "SmsMessageKind.received"
    },
    {
      "sender": "VK-CBSSBI-S",
      "body": "Dear Customer, TDR/STDR No XXXXX304600 for INR 9,000.00 has been created on 02/06/25. Please submit form 15G/H, if eligible. Thank you for your patronage. Download YONO - SBI",
      "date": "2025-06-02T12:04:45.219",
      "type": "SmsMessageKind.received"
    },
    {
      "sender": "AX-CBSSBI-S",
      "body": "Your A/C XXXXX869855 Debited INR 9,000.00 on 02/06/25 -Transferred to Mr. DivyamVerma. Avl Balance INR 59,344.21-SBI",
      "date": "2025-06-02T12:04:39.849",
      "type": "SmsMessageKind.received"
    },
    {
      "sender": "JX-JIONET-S",
      "body": "Dear Customer, \nService request no SR00002EPYUJ has been raised in your account. \nYou will receive an update for this request by 02/06/2025 21:35. \nTo track the status of your service requests at your convenience, please visit MyJio App - https://www.jio.com/dl/track_sr_status",
      "date": "2025-06-01T21:36:06.860",
      "type": "SmsMessageKind.received"
    },
    {
      "sender": "AX-AIRTEL",
      "body": "Alert 50%: data is consumed. Get 2GB at Rs33 till Midnight. Recharge now i.airtel.in/dtpck",
      "date": "2025-06-01T16:37:18.590",
      "type": "SmsMessageKind.received"
    },
    {
      "sender": "AX-AIRTEL",
      "body": "Alert 50%: data is consumed. Get 2GB at Rs33 till Midnight. Recharge now i.airtel.in/dtpck",
      "date": "2025-05-31T19:23:47.845",
      "type": "SmsMessageKind.received"
    },
    {
      "sender": "AX-AIRTEL",
      "body": "500 MB high speed data: left in your current pack. To continue using high speed data, recharge with Rs161 pack to get 12GB. Visit https://i.airtel.in/kdtpck",
      "date": "2025-05-30T16:18:42.179",
      "type": "SmsMessageKind.received"
    },
    {
      "sender": "AX-AIRTEL",
      "body": "Alert 100%: for your daily high speed data limit. Get 2GB at Rs33 till Midnight. Recharge now i.airtel.in/dtpck",
      "date": "2025-05-30T16:07:53.083",
      "type": "SmsMessageKind.received"
    },
    {
      "sender": "AX-AIRTEL",
      "body": "Alert 90%: data is consumed. Get 2GB at Rs33 till Midnight. Recharge now i.airtel.in/dtpck",
      "date": "2025-05-30T16:07:45.873",
      "type": "SmsMessageKind.received"
    },
    {
      "sender": "AX-AIRTEL",
      "body": "Alert 50%: data is consumed. Get 2GB at Rs33 till Midnight. Recharge now i.airtel.in/dtpck",
      "date": "2025-05-30T12:40:36.403",
      "type": "SmsMessageKind.received"
    },
    {
      "sender": "+919670670079",
      "body": "Respected Rama Sarswati Maurya,\nLIC Policy 276555356\nDue On-26/05/2025\nAmount-38249.0\nKindly Ignore if paid.\nRegards\nBHANU PRAKASH SHARMA \n+91 9415176119",
      "date": "2025-05-29T15:33:33.975",
      "type": "SmsMessageKind.received"
    },
    {
      "sender": "AX-CBSSBI-S",
      "body": "Your A/C XXXXX869855 Credited INR 11,022.00 on 29/05/25 -Deposit by transfer from Mr. DivyamVerma. Avl Bal INR 11,063.21-SBI",
      "date": "2025-05-29T13:44:00.623",
      "type": "SmsMessageKind.received"
    },
    {
      "sender": "AX-CBSSBI-S",
      "body": "Dear Customer, Your A/C XXXXX869855 Credited. INR 11,022.00 on 29/05/25 on account of Closure of TD A/c XXXXX712238.-SBI",
      "date": "2025-05-29T13:44:00.161",
      "type": "SmsMessageKind.received"
    },
    {
      "sender": "AD-CBSSBI-S",
      "body": "Dear Customer, Your A/C XXXXX712238 has a debit by transfer of Rs 11,022.00 on 29/05/25. Avl Bal Rs 0.00.-SBI",
      "date": "2025-05-29T13:43:59.298",
      "type": "SmsMessageKind.received"
    },
    {
      "sender": "AX-AIRTEL",
      "body": "Alert 100%: for your daily high speed data limit. Get 2GB at Rs33 till Midnight. Recharge now i.airtel.in/dtpck",
      "date": "2025-05-29T11:23:31.299",
      "type": "SmsMessageKind.received"
    },
    {
      "sender": "AX-AIRTEL",
      "body": "Alert 90%: data is consumed. Get 2GB at Rs33 till Midnight. Recharge now i.airtel.in/dtpck",
      "date": "2025-05-29T11:09:36.440",
      "type": "SmsMessageKind.received"
    },
    {
      "sender": "Airtel-S",
      "body": "Enjoy 5GB data valid for 7 days.Also get EXTRA 1GB on your next recharge of Rs77 for your Airtel Mobile, only on Airtel Thanks App. Click i.airtel.in/rech_now",
      "date": "2025-05-28T14:16:40.809",
      "type": "SmsMessageKind.received"
    },
    {
      "sender": "AX-AIRTEL",
      "body": "Alert 100%: for your daily high speed data limit. Get 2GB at Rs33 till Midnight. Recharge now i.airtel.in/dtpck",
      "date": "2025-05-28T12:35:12.752",
      "type": "SmsMessageKind.received"
    },
    {
      "sender": "AX-AIRTEL",
      "body": "Alert 90%: data is consumed. Get 2GB at Rs33 till Midnight. Recharge now i.airtel.in/dtpck",
      "date": "2025-05-28T12:13:27.184",
      "type": "SmsMessageKind.received"
    },
    {
      "sender": "AX-AIRTEL",
      "body": "Alert 50%: data is consumed. Get 2GB at Rs33 till Midnight. Recharge now i.airtel.in/dtpck",
      "date": "2025-05-28T02:18:42.651",
      "type": "SmsMessageKind.received"
    },
    {
      "sender": "AX-AIRTEL",
      "body": "1GB high speed data: left in your current pack. To continue using high speed data, recharge with Rs161 pack to get 12GB. Visit https://i.airtel.in/kdtpck",
      "date": "2025-05-28T00:04:01.678",
      "type": "SmsMessageKind.received"
    },
    {
      "sender": "AX-AIRTEL",
      "body": "Alert 100%: for your daily high speed data limit. Get 2GB at Rs33 till Midnight. Recharge now i.airtel.in/dtpck",
      "date": "2025-05-27T15:08:10.649",
      "type": "SmsMessageKind.received"
    },
    {
      "sender": "AX-AIRTEL",
      "body": "Alert 90%: data is consumed. Get 2GB at Rs33 till Midnight. Recharge now i.airtel.in/dtpck",
      "date": "2025-05-27T14:27:47.021",
      "type": "SmsMessageKind.received"
    },
    {
      "sender": "AX-AIRTEL",
      "body": "Alert 50%: data is consumed. Get 2GB at Rs33 till Midnight. Recharge now i.airtel.in/dtpck",
      "date": "2025-05-27T12:49:29.155",
      "type": "SmsMessageKind.received"
    },
    {
      "sender": "AX-AIRTEL",
      "body": "Alert 100%: for your daily high speed data limit. Get 2GB at Rs33 till Midnight. Recharge now i.airtel.in/dtpck",
      "date": "2025-05-26T19:07:50.539",
      "type": "SmsMessageKind.received"
    },
    {
      "sender": "AX-AIRTEL",
      "body": "Alert 90%: data is consumed. Get 2GB at Rs33 till Midnight. Recharge now i.airtel.in/dtpck",
      "date": "2025-05-26T17:44:15.744",
      "type": "SmsMessageKind.received"
    },
    {
      "sender": "AX-AIRTEL",
      "body": "Alert 50%: data is consumed. Get 2GB at Rs33 till Midnight. Recharge now i.airtel.in/dtpck",
      "date": "2025-05-26T15:03:06.114",
      "type": "SmsMessageKind.received"
    },
    {
      "sender": "Airtel-S",
      "body": "Enjoy 5GB data valid for 7 days.Also get EXTRA 1GB on your next recharge of Rs77 for your Airtel Mobile, only on Airtel Thanks App. Click i.airtel.in/rech_now",
      "date": "2025-05-26T11:42:07.785",
      "type": "SmsMessageKind.received"
    },
    {
      "sender": "JK-SBIBNK-P",
      "body": "Dear Customer, You can withdraw Cash securely from SBI ATMs without ATM/ Debit card. Open YONO APP & Tap on YONO Cash. T&Cs Apply-SBI",
      "date": "2025-05-26T10:57:57.162",
      "type": "SmsMessageKind.received"
    },
    {
      "sender": "AX-AIRTEL",
      "body": "Alert 100%: for your daily high speed data limit. Get 2GB at Rs33 till Midnight. Recharge now i.airtel.in/dtpck",
      "date": "2025-05-25T23:32:48.789",
      "type": "SmsMessageKind.received"
    },
    {
      "sender": "AX-AIRTEL",
      "body": "Alert 90%: data is consumed. Get 2GB at Rs33 till Midnight. Recharge now i.airtel.in/dtpck",
      "date": "2025-05-25T23:01:37.174",
      "type": "SmsMessageKind.received"
    },
    {
      "sender": "AX-AIRTEL",
      "body": "Alert 50%: data is consumed. Get 2GB at Rs33 till Midnight. Recharge now i.airtel.in/dtpck",
      "date": "2025-05-25T21:13:50.663",
      "type": "SmsMessageKind.received"
    },
    {
      "sender": "AX-AIRTEL",
      "body": "Alert 90%: data is consumed. Get 2GB at Rs33 till Midnight. Recharge now i.airtel.in/dtpck",
      "date": "2025-05-24T19:35:15.567",
      "type": "SmsMessageKind.received"
    },
    {
      "sender": "AX-AIRTEL",
      "body": "Alert 50%: data is consumed. Get 2GB at Rs33 till Midnight. Recharge now i.airtel.in/dtpck",
      "date": "2025-05-24T17:37:15.774",
      "type": "SmsMessageKind.received"
    },
    {
      "sender": "JK-NSESMS-S",
      "body": "ZERODHA BROKING LIMITED on 17-05-25 reported your Fund bal Rs.0.06 & Securities bal 0. This excludes your Bank, DP & PMS bal with the broker-NSE",
      "date": "2025-05-24T12:03:14.055",
      "type": "SmsMessageKind.received"
    },
    {
      "sender": "JK-SBIBNK-P",
      "body": "Dear Customer, Explore quick money transfers with YONO SBI Quick Pay. Visit YONO SBI > Tap on Quick Pay options. - SBI",
      "date": "2025-05-24T10:47:14.368",
      "type": "SmsMessageKind.received"
    },
    {
      "sender": "JK-SBIUPI-S",
      "body": "Dear UPI user A/C X9855 debited by 49.0 on date 23May25 trf to Airtel Recharge Refno 608448341246. If not u? call 1800111109. -SBI",
      "date": "2025-05-23T14:05:01.552",
      "type": "SmsMessageKind.received"
    },
    {
      "sender": "AX-AIRTEL",
      "body": "Alert 100%: for your daily high speed data limit. Get 2GB at Rs33 till Midnight. Recharge now i.airtel.in/dtpck",
      "date": "2025-05-23T13:41:01.824",
      "type": "SmsMessageKind.received"
    },
    {
      "sender": "AX-AIRTEL",
      "body": "Alert 90%: data is consumed. Get 2GB at Rs33 till Midnight. Recharge now i.airtel.in/dtpck",
      "date": "2025-05-23T13:39:38.648",
      "type": "SmsMessageKind.received"
    },
    {
      "sender": "AX-AIRTEL",
      "body": "Alert 50%: data is consumed. Get 2GB at Rs33 till Midnight. Recharge now i.airtel.in/dtpck",
      "date": "2025-05-23T13:33:25.925",
      "type": "SmsMessageKind.received"
    },
    {
      "sender": "AX-AIRTEL",
      "body": "Alert 90%: data is consumed. Get 2GB at Rs33 till Midnight. Recharge now i.airtel.in/dtpck",
      "date": "2025-05-22T22:06:41.164",
      "type": "SmsMessageKind.received"
    },
    {
      "sender": "AX-AIRTEL",
      "body": "Alert 50%: data is consumed. Get 2GB at Rs33 till Midnight. Recharge now i.airtel.in/dtpck",
      "date": "2025-05-22T15:51:18.013",
      "type": "SmsMessageKind.received"
    },
    {
      "sender": "AX-AIRTEL",
      "body": "Alert 50%: data is consumed. Get 2GB at Rs33 till Midnight. Recharge now i.airtel.in/dtpck",
      "date": "2025-05-21T12:00:17.753",
      "type": "SmsMessageKind.received"
    },
    {
      "sender": "AX-AIRTEL",
      "body": "Alert 50%: data is consumed. Get 2GB at Rs33 till Midnight. Recharge now i.airtel.in/dtpck",
      "date": "2025-05-20T19:46:22.659",
      "type": "SmsMessageKind.received"
    },
    {
      "sender": "JD-BSELTD-S",
      "body": "ZERODHA BROKING at EOD 30/04/2025 reported your Fund bal Rs 0.060 & Securities bal 0. This excludes your Bank, DP and PMS bal with the broker-BSE",
      "date": "2025-05-19T13:23:51.193",
      "type": "SmsMessageKind.received"
    },
    {
      "sender": "AX-650024-P",
      "body": "Access movies and live TV on Airtel Xstream Play at no added cost. Watch now - open.airtelxstream.in/FREE_MOVIES",
      "date": "2025-05-19T12:42:09.857",
      "type": "SmsMessageKind.received"
    },
    {
      "sender": "AX-AIRTEL",
      "body": "Alert 50%: data is consumed. Get 2GB at Rs33 till Midnight. Recharge now i.airtel.in/dtpck",
      "date": "2025-05-19T07:02:03.682",
      "type": "SmsMessageKind.received"
    },
    {
      "sender": "AX-AIRTEL",
      "body": "Alert 50%: data is consumed. Get 2GB at Rs33 till Midnight. Recharge now i.airtel.in/dtpck",
      "date": "2025-05-18T16:25:16.074",
      "type": "SmsMessageKind.received"
    },
    {
      "sender": "AD-AIROAM",
      "body": "Welcome to Uttar Pradesh! Keep your Mobile Data Roaming ON for seamless data experience. Make calls and use data included in your current pack anywhere in the country at no extra cost and enjoy spam protection- live on Airtel.  You can check details about your pack on Airtel Thanks App i.airtel.in/airdb1",
      "date": "2025-05-18T09:48:54.650",
      "type": "SmsMessageKind.received"
    },
    {
      "sender": "AX-AIRTEL",
      "body": "Alert 50%: data is consumed. Get 2GB at Rs33 till Midnight. Recharge now i.airtel.in/dtpck",
      "date": "2025-05-17T13:35:46.214",
      "type": "SmsMessageKind.received"
    },
    {
      "sender": "VM-AKASAA-S",
      "body": "Hi, your Akasa Air flight QP 1527,BLR-LKO,18 May 2025,PNR Y9UITG is now open for check-in. Please use the link https://gs.im/AKASAA/e/bQHcRO6mTYl to select your preferred seat. Enjoy generous legroom on all our seats or choose an A+ seat for enhanced legroom and comfort.Please note that power banks, lithium batteries, portable mobile chargers and laptops are allowed only in the hand (cabin) baggage and cannot be carried in the checked-in baggage. Warm regards, Team Akasa",
      "date": "2025-05-17T05:37:17.727",
      "type": "SmsMessageKind.received"
    },
    {
      "sender": "VM-AKASAA-S",
      "body": "Hi Divyam, web check-in for your Akasa Air flight QP 1527 to LKO (T3) on 18 May 25 (PNR - Y9UITG) was successful. Download your e-boarding pass on www.akasaair.com",
      "date": "2025-05-17T02:37:15.388",
      "type": "SmsMessageKind.received"
    },
    {
      "sender": "AX-AIRTEL",
      "body": "Alert 90%: data is consumed. Get 2GB at Rs33 till Midnight. Recharge now i.airtel.in/dtpck",
      "date": "2025-05-16T22:37:43.991",
      "type": "SmsMessageKind.received"
    },
    {
      "sender": "JM-NSESMS-S",
      "body": "ZERODHA BROKING LIMITED on 10-05-25 reported your Fund bal Rs.0.06 & Securities bal 0. This excludes your Bank, DP & PMS bal with the broker-NSE",
      "date": "2025-05-16T18:55:06.263",
      "type": "SmsMessageKind.received"
    },
    {
      "sender": "AX-AIRTEL",
      "body": "Alert 50%: data is consumed. Get 2GB at Rs33 till Midnight. Recharge now i.airtel.in/dtpck",
      "date": "2025-05-16T02:49:23.940",
      "type": "SmsMessageKind.received"
    },
    {
      "sender": "AX-AIRTEL",
      "body": "Alert 50%: data is consumed. Get 2GB at Rs33 till Midnight. Recharge now i.airtel.in/dtpck",
      "date": "2025-05-15T20:29:08.638",
      "type": "SmsMessageKind.received"
    },
    {
      "sender": "+919670670079",
      "body": "Respected Rama Sarswati Maurya,\nLIC Policy 276555356\nDue On-26/05/2025\nAmount-38249.0\nKindly Ignore if paid.\nRegards\nBHANU PRAKASH SHARMA \n+91 9415176119",
      "date": "2025-05-15T09:02:02.782",
      "type": "SmsMessageKind.received"
    },
    {
      "sender": "AX-AIRTEL",
      "body": "Alert 50%: data is consumed. Get 2GB at Rs33 till Midnight. Recharge now i.airtel.in/dtpck",
      "date": "2025-05-14T23:47:31.884",
      "type": "SmsMessageKind.received"
    },
    {
      "sender": "+919670670079",
      "body": "Respected Rama Sarswati Maurya,\nLIC Policy 276555356\nDue On-26/05/2025\nAmount-38249.0\nKindly Ignore if paid.\nRegards\nBHANU PRAKASH SHARMA \n+91 9415176119",
      "date": "2025-05-14T14:11:19.937",
      "type": "SmsMessageKind.received"
    },
    {
      "sender": "JK-SBIUPI-S",
      "body": "Dear UPI user A/C X9855 debited by 15.0 on date 14May25 trf to KA01AR1687 Refno 698325001253. If not u? call 1800111109. -SBI",
      "date": "2025-05-14T11:35:08.769",
      "type": "SmsMessageKind.received"
    },
    {
      "sender": "JK-JIONET",
      "body": "Dear Customer, \nService request no SR00002DHW91 has been raised in your account. \nYou will receive an update for this request by 14/05/2025 22:27. \nTo track the status of your service requests at your convenience, please visit MyJio App - https://www.jio.com/dl/track_sr_status",
      "date": "2025-05-13T22:28:06.831",
      "type": "SmsMessageKind.received"
    },
    {
      "sender": "JK-NSESMS-S",
      "body": "SBICAP SECURITIES LIMITED on 03-05-25 reported your Fund bal Rs.0 & Securities bal 0. This excludes your Bank, DP & PMS bal with the broker-NSE",
      "date": "2025-05-13T11:14:59.214",
      "type": "SmsMessageKind.received"
    },
    {
      "sender": "JZ-JIOFBR",
      "body": "Dear Customer, \nYour JioFiber bill dated11-May-2025 for JioFixedVoice Number +918031639466 has been sent to your email ID divyamverma125@gmail.com. \nBill Summary : \nBill period : 11-Apr-2025 to 10-May-2025 \nTotal Amount payable : Rs. 470.82 \nPayment due date: 20-MAY-2025 \nTo view your bill, click http://jio.com/my_bills.\nFor a step by step guide to help you easily understand your bill, click https://t.jio/JioFiber_BillGuide .\nTeam JioFiber",
      "date": "2025-05-13T08:05:54.518",
      "type": "SmsMessageKind.received"
    },
    {
      "sender": "JK-NSESMS-S",
      "body": "ZERODHA BROKING LIMITED on 03-05-25 reported your Fund bal Rs.0.06 & Securities bal 0. This excludes your Bank, DP & PMS bal with the broker-NSE",
      "date": "2025-05-12T21:16:40.972",
      "type": "SmsMessageKind.received"
    },
    {
      "sender": "AX-650002-P",
      "body": "Your Airtel pack on 8881XXX839 is about to expire!\nRecharge now with Rs299 to stay connected. Get unlimited calls, 1.5GB data/day & 100 SMS/day for 28 days. Recharge on Airtel Thanks App with ZERO CONVENIENCE FEE  i.airtel.in/AirRech",
      "date": "2025-05-10T14:38:48.399",
      "type": "SmsMessageKind.received"
    },
    {
      "sender": "Airtel-S",
      "body": "Recharge of INR 299.00 is successful for your Airtel Mobile on 10-05-2025 13:05, Transaction ID 1100591300.Check your balance, validity, tariff and best recharges on Airtel Thanks App i.airtel.in/SerAIr . Spam protection is live on your Airtel number.",
      "date": "2025-05-10T13:05:27.794",
      "type": "SmsMessageKind.received"
    },
    {
      "sender": "JK-SBIUPI-S",
      "body": "Dear UPI user A/C X9855 debited by 29.0 on date 08May25 trf to SRI MANDHAPPA ST Refno 577055536856. If not u? call 1800111109. -SBI",
      "date": "2025-05-08T21:20:32.978",
      "type": "SmsMessageKind.received"
    },
    {
      "sender": "AD-AIRTEL",
      "body": "Hi, you can stream live cricket match on JioHotstar, active with your Airtel pack. Check your data balance and ensure you do not run out of data during the match. Click https://i.airtel.in/Prepaidservice.\nYou can also avail additional data with Airtel data packs.",
      "date": "2025-05-08T18:49:29.777",
      "type": "SmsMessageKind.received"
    },
    {
      "sender": "AX-AIRTEL",
      "body": "Airtel Unlimited Pack validity for 8881384839 is till 10-May-25. Recharge TODAY without losing your current validity i.airtel.in/FDPNew Ignore if already done",
      "date": "2025-05-08T16:47:05.491",
      "type": "SmsMessageKind.received"
    },
    {
      "sender": "AX-650003",
      "body": "Your Airtel pack on 8881XXX839 is about to expire!\nRecharge now with Rs799 to stay connected. Get UL calls, 1.5GB data/day & 100 SMS/day for 84 days. Recharge on Airtel Thanks App with ZERO CONVENIENCE FEE  i.airtel.in/AirRech",
      "date": "2025-05-08T13:36:36.881",
      "type": "SmsMessageKind.received"
    },
    {
      "sender": "JK-SBIUPI-S",
      "body": "Dear UPI user A/C X9855 debited by 20.0 on date 08May25 trf to KARNATAKA STORE Refno 346140006357. If not u? call 1800111109. -SBI",
      "date": "2025-05-08T08:35:17.816",
      "type": "SmsMessageKind.received"
    },
    {
      "sender": "AD-AIRTEL",
      "body": "Hi, you can stream live cricket match on JioHotstar, active with your Airtel pack. Check your data balance and ensure you do not run out of data during the match. Click https://i.airtel.in/Prepaidservice.\nYou can also avail additional data with Airtel data packs.",
      "date": "2025-05-07T18:29:06.047",
      "type": "SmsMessageKind.received"
    },
    {
      "sender": "AX-AIRTEL",
      "body": "Airtel pack on 8881384839 ends on 10-May-25. Recharge today without losing your current validity i.airtel.in/FDPNew Ignore if already done",
      "date": "2025-05-07T14:28:02.202",
      "type": "SmsMessageKind.received"
    },
    {
      "sender": "JD-SBIUPI-S",
      "body": "Dear UPI user A/C X9855 debited by 85.0 on date 07May25 trf to M/S.MONAMI HOSPI Refno 566864516254. If not u? call 1800111109. -SBI",
      "date": "2025-05-07T13:44:07.396",
      "type": "SmsMessageKind.received"
    },
    {
      "sender": "JD-SBIUPI",
      "body": "Dear UPI user A/C X9855 debited by 270.0 on date 06May25 trf to SAVAD  KOVVAL Refno 652620323175. If not u? call 1800111109. -SBI",
      "date": "2025-05-06T22:54:46.789",
      "type": "SmsMessageKind.received"
    },
    {
      "sender": "AD-SBIUPI-S",
      "body": "Dear UPI user A/C X9855 debited by 15.0 on date 06May25 trf to KISHORE  MARKAND Refno 441148241717. If not u? call 1800111109. -SBI",
      "date": "2025-05-06T17:10:15.420",
      "type": "SmsMessageKind.received"
    },
    {
      "sender": "JK-SBIUPI",
      "body": "Dear UPI user A/C X9855 debited by 50.0 on date 06May25 trf to RIAZ PASHA SHAIK Refno 098144833432. If not u? call 1800111109. -SBI",
      "date": "2025-05-06T12:42:23.876",
      "type": "SmsMessageKind.received"
    },
    {
      "sender": "JD-SBIUPI",
      "body": "Dear UPI user A/C X9855 debited by 300.0 on date 06May25 trf to PhonePe Refno 946535649571. If not u? call 1800111109. -SBI",
      "date": "2025-05-06T01:38:38.999",
      "type": "SmsMessageKind.received"
    },
    {
      "sender": "AX-SBIUPI",
      "body": "Dear UPI user A/C X9855 debited by 20.0 on date 05May25 trf to HALLI MANE DONNE Refno 207458470281. If not u? call 1800111109. -SBI",
      "date": "2025-05-05T14:15:21.881",
      "type": "SmsMessageKind.received"
    },
    {
      "sender": "AD-SBIUPI",
      "body": "Dear UPI user A/C X9855 debited by 60.0 on date 05May25 trf to M/S.MONAMI HOSPI Refno 049916943187. If not u? call 1800111109. -SBI",
      "date": "2025-05-05T14:02:47.586",
      "type": "SmsMessageKind.received"
    },
    {
      "sender": "VD-PVRVIP",
      "body": "Ready for some mid-week movie magic? PVR Blockbuster Tuesdays are now UNBEATABLE! Grab tickets starting at INR 99! T&C Apply. https://pvr.im/PVRVIP/NTq420xC",
      "date": "2025-05-05T13:46:53.909",
      "type": "SmsMessageKind.received"
    },
    {
      "sender": "VK-CBSSBI",
      "body": "Your A/C XXXXX869855 Debited INR 11,000.00 on 05/05/25 -Transferred to Mr. DivyamVerma. Avl Balance INR 10,581.22-SBI",
      "date": "2025-05-05T08:10:03.841",
      "type": "SmsMessageKind.received"
    },
    {
      "sender": "VA-CBSSBI",
      "body": "Dear Customer, TDR/STDR No XXXXX712238 for INR 11,000.00 has been created on 05/05/25. Please submit form 15G/H, if eligible. Thank you for your patronage. Download YONO - SBI",
      "date": "2025-05-05T08:09:59.347",
      "type": "SmsMessageKind.received"
    },
    {
      "sender": "VK-CBSSBI",
      "body": "Dear Customer, Your A/C XXXXX663882 has a debit by transfer of Rs 9,000.00 on 04/05/25. Avl Bal Rs 0.00.-SBI",
      "date": "2025-05-04T15:08:20.506",
      "type": "SmsMessageKind.received"
    },
    {
      "sender": "VM-CBSSBI",
      "body": "Dear Customer, Your A/C XXXXX869855 Credited. INR 11,000.00 on 04/05/25 on account of Closure of TD A/c XXXXX384491.-SBI",
      "date": "2025-05-04T15:08:17.566",
      "type": "SmsMessageKind.received"
    },
    {
      "sender": "VK-ATMSBI",
      "body": "Dear SBI Customer, Rs.2500 withdrawn at RAB ATM RE289001 from A/cX9855 on 04May25 Transaction Number 512414000187. Available Balance Rs.14382.22. If not withdrawn by you, forward this SMS to 7400165218 / call 1800111109 or 09449112211 to block your card. Call 18001234 if cash not received.",
      "date": "2025-05-04T14:42:28.828",
      "type": "SmsMessageKind.received"
    },
    {
      "sender": "VM-ATMSBI",
      "body": "Dear SBI Customer, Rs.10000 withdrawn at RAB ATM RE289001 from A/cX9855 on 04May25 Transaction Number 512414000185. Available Balance Rs.16882.22. If not withdrawn by you, forward this SMS to 7400165218 / call 1800111109 or 09449112211 to block your card. Call 18001234 if cash not received.",
      "date": "2025-05-04T14:41:10.406",
      "type": "SmsMessageKind.received"
    },
    {
      "sender": "VM-CBSSBI",
      "body": "Your A/C XXXXX869855 Debited INR 9,000.00 on 04/05/25 -Transferred to Mr. DivyamVerma. Avl Balance INR 27,682.22-SBI",
      "date": "2025-05-04T08:30:27.308",
      "type": "SmsMessageKind.received"
    },
    {
      "sender": "VM-CBSSBI",
      "body": "Dear Customer, TDR/STDR No XXXXX384491 for INR 11,000.00 has been created on 04/05/25. Please submit form 15G/H, if eligible. Thank you for your patronage. Download YONO - SBI",
      "date": "2025-05-04T07:25:25.967",
      "type": "SmsMessageKind.received"
    },
    {
      "sender": "VK-SBIUPI",
      "body": "Dear UPI user A/C X9855 debited by 4000.0 on date 03May25 trf to Sonam  Verma Refno 559369947835. If not u? call 1800111109. -SBI",
      "date": "2025-05-03T12:53:14.222",
      "type": "SmsMessageKind.received"
    },
    {
      "sender": "VM-SBIPSG",
      "body": "Dear Customer, INR 60,000.00 credited to your A/c No XX9855 on 03/05/2025 through NEFT with UTR YESOB51230607441 by STATION91 TECHNOLOGIES PRIVATE LIMI, INFO: BATCHID:0006 SALARY APRIL 2025-SBI",
      "date": "2025-05-03T06:38:17.868",
      "type": "SmsMessageKind.received"
    },
    {
      "sender": "AD-axioFS",
      "body": "Pay axio Pay Later bill of Rs3741 by 5th of this month: https://u.axio.co/axo/Tz6YtFtvvhvt4B\nBill: https://u.axio.co/axo/SeOqyoggcdpfdgq\naxio",
      "date": "2025-05-02T11:15:23.153",
      "type": "SmsMessageKind.received"
    },
    {
      "sender": "AX-650024",
      "body": "Free entertainment with Airtel! Access movies and live TV on Airtel Xstream Play at no added cost. Watch now - open.airtelxstream.in/FREE_TVSHOWS",
      "date": "2025-05-01T14:51:09.417",
      "type": "SmsMessageKind.received"
    },
    {
      "sender": "JD-SBIUPI",
      "body": "Dear UPI user A/C X9855 debited by 190.0 on date 01May25 trf to zeptonow Refno 860019236683. If not u? call 1800111109. -SBI",
      "date": "2025-05-01T10:35:00.283",
      "type": "SmsMessageKind.received"
    },
    {
      "sender": "JK-SBIUPI",
      "body": "Dear UPI user A/C X9855 debited by 40.0 on date 28Apr25 trf to FOOD COURT Refno 720907515146. If not u? call 1800111109. -SBI",
      "date": "2025-04-28T19:18:51.115",
      "type": "SmsMessageKind.received"
    },
    {
      "sender": "57575711",
      "body": "Your Apple Account code is: 447475. Do not share it with anyone.",
      "date": "2025-04-27T18:12:33.421",
      "type": "SmsMessageKind.received"
    },
    {
      "sender": "JG-JIONET",
      "body": "Dear Customer, \nService request no SR00002CGKDT has been raised in your account. You will receive an update for this request by 27/04/2025 15:22. To track the status of your service requests at your convenience, please visit MyJio App - https://www.jio.com/track_sr_status",
      "date": "2025-04-26T15:22:29.962",
      "type": "SmsMessageKind.received"
    },
    {
      "sender": "JK-NSESMS",
      "body": "SBICAP SECURITIES LIMITED on 19-04-25 reported your Fund bal Rs.0 & Securities bal 0. This excludes your Bank, DP & PMS bal with the broker-NSE",
      "date": "2025-04-26T14:02:32.343",
      "type": "SmsMessageKind.received"
    },
    {
      "sender": "AD-AIRTEL",
      "body": "Hi, you can stream live cricket match on JioHotstar, active with your Airtel pack. Check your data balance and ensure you do not run out of data during the match. Click https://i.airtel.in/Prepaidservice.\nYou can also avail additional data with Airtel data packs.",
      "date": "2025-04-25T18:31:34.878",
      "type": "SmsMessageKind.received"
    },
    {
      "sender": "AX-NSESMS",
      "body": "ZERODHA BROKING LIMITED on 19-04-25 reported your Fund bal Rs.0.06 & Securities bal 0. This excludes your Bank, DP & PMS bal with the broker-NSE",
      "date": "2025-04-25T17:13:10.999",
      "type": "SmsMessageKind.received"
    },
    {
      "sender": "VK-SxCIAL",
      "body": "Hey, SOCIAL missed your vibe! Come back for 50% OFF (up to Rs.1000). Great #eats & #drnks await. Valid till 27 Apr. Call 9152017971 to book! T&C.",
      "date": "2025-04-25T16:11:20.710",
      "type": "SmsMessageKind.received"
    },
    {
      "sender": "JD-SBIUPI",
      "body": "Dear UPI user A/C X9855 debited by 85.0 on date 25Apr25 trf to M/S.MONAMI HOSPI Refno 992771042613. If not u? call 1800111109. -SBI",
      "date": "2025-04-25T13:55:12.810",
      "type": "SmsMessageKind.received"
    },
    {
      "sender": "JX-JIONET",
      "body": "Dear Customer, \nService request no SR00002CDIYX has been raised in your account. You will receive an update for this request by 25/04/2025 23:07. To track the status of your service requests at your convenience, please visit MyJio App - https://www.jio.com/track_sr_status",
      "date": "2025-04-24T23:07:53.509",
      "type": "SmsMessageKind.received"
    },
    {
      "sender": "JD-RZPBM",
      "body": "Here is your Star bazzar's bill\nhttps://yourbill.me?i=ek6d7um9tya41x\n\n- RazorpayBillme",
      "date": "2025-04-23T18:39:11.233",
      "type": "SmsMessageKind.received"
    },
    {
      "sender": "VM-SBIUPI",
      "body": "Dear UPI user A/C X9855 debited by 10.0 on date 23Apr25 trf to BRIGHT STELLAR I Refno 700735832911. If not u? call 1800111109. -SBI",
      "date": "2025-04-23T17:29:02.417",
      "type": "SmsMessageKind.received"
    },
    {
      "sender": "JM-NSESMS",
      "body": "SBICAP SECURITIES LIMITED on 12-04-25 reported your Fund bal Rs.0 & Securities bal 0. This excludes your Bank, DP & PMS bal with the broker-NSE",
      "date": "2025-04-22T07:36:18.809",
      "type": "SmsMessageKind.received"
    },
    {
      "sender": "AD-AIRTEL",
      "body": "Hi, you can stream live cricket match on JioHotstar, active with your Airtel pack. Check your data balance and ensure you do not run out of data during the match. Click https://i.airtel.in/Prepaidservice.\nYou can also avail additional data with Airtel data packs.",
      "date": "2025-04-21T18:44:12.196",
      "type": "SmsMessageKind.received"
    },
    {
      "sender": "AX-650024",
      "body": "Free entertainment with Airtel! Access movies and live TV on Airtel Xstream Play at no added cost. Watch now - open.airtelxstream.in/FREE_TVSHOWS",
      "date": "2025-04-21T11:38:33.589",
      "type": "SmsMessageKind.received"
    },
    {
      "sender": "VK-SBIUPI",
      "body": "Dear UPI user A/C X9855 debited by 5000.0 on date 21Apr25 trf to ICCL ZERODHA COI Refno 100399108125. If not u? call 1800111109. -SBI",
      "date": "2025-04-21T10:00:40.339",
      "type": "SmsMessageKind.received"
    },
    {
      "sender": "VA-CBSSBI",
      "body": "Dear Customer, Your A/C XXXXX701850 has a debit by transfer of Rs 11,021.00 on 21/04/25. Avl Bal Rs 0.00.-SBI",
      "date": "2025-04-21T09:06:15.586",
      "type": "SmsMessageKind.received"
    },
    {
      "sender": "VK-SBIUPI",
      "body": "Dear User UPI LITE Top-up on SBI Rs.100.00 is successful. Ref No 426792174439. If not done by u, call 18001234 -SBI",
      "date": "2025-04-19T12:00:20.747",
      "type": "SmsMessageKind.received"
    },
    {
      "sender": "AD-CKYCR",
      "body": "Dear Divyam, your CKYCRR record bearing reference 20019728320328 was fetched by INDMONEY PRIVATE LIMITED on 19/04/2025.-CERSAI",
      "date": "2025-04-19T01:38:47.962",
      "type": "SmsMessageKind.received"
    },
    {
      "sender": "AX-CKYCR",
      "body": "Dear Divyam, your CKYCRR record bearing reference 20019728320328 was fetched by INDMONEY PRIVATE LIMITED on 19/04/2025.-CERSAI",
      "date": "2025-04-19T01:38:36.704",
      "type": "SmsMessageKind.received"
    },
    {
      "sender": "VK-SBIUPI",
      "body": "Dear User UPI LITE Top-up on SBI Rs.100.00 is successful. Ref No 679775006117. If not done by u, call 18001234 -SBI",
      "date": "2025-04-18T12:17:35.205",
      "type": "SmsMessageKind.received"
    },
    {
      "sender": "VA-SBIUPI",
      "body": "Dear User UPI LITE Top-up on SBI Rs.100.00 is successful. Ref No 480040914671. If not done by u, call 18001234 -SBI",
      "date": "2025-04-16T11:58:43.910",
      "type": "SmsMessageKind.received"
    },
    {
      "sender": "AD-AIRBIL",
      "body": "\nHi Divyam, Bill for your Airtel Mobile  8881384839 dated 14-APR-2025 has been generated.\nAmount to be paid: Rs 0.01\nDue Date: 16-MAY-2025\nPrevious Due: Rs 529.82\nPayment made: Rs 671.10\nThis month's charges: Rs 141.29 (inclusive of tax) \nDetail Charges-\nPlan Rental: Rs 119.73\nTax: Rs 21.56\n \nTo view your bill or to make payment, please visit https://i.airtel.in/PPBillbreakup\nTo understand your bill, click https://youtu.be/y1JoFufRp30\n",
      "date": "2025-04-14T15:41:17.901",
      "type": "SmsMessageKind.received"
    },
    {
      "sender": "VA-SBIUPI",
      "body": "Dear User UPI LITE Top-up on SBI Rs.100.00 is successful. Ref No 850744714924. If not done by u, call 18001234 -SBI",
      "date": "2025-04-14T11:52:37.777",
      "type": "SmsMessageKind.received"
    },
    {
      "sender": "AX-AIRTEL",
      "body": "Data quota left 100 MB: Only 100MB of high speed data left on your Airtel number. Recharge with Data Packs starting Rs 11 to enjoy uninterrupted data services i.airtel.in/Get-Data",
      "date": "2025-04-13T21:49:36.419",
      "type": "SmsMessageKind.received"
    },
    {
      "sender": "CP-JIOHTT",
      "body": "Mobile 3 Month has been successfully added to your JioHotstar account linked to this phone number\n\nIt is currently queued and will start once your active plan expires. To view your subscriptions ensure you have the latest JioHotstar app http://1kx.in/JIOHTT/XW0oObhtDS1",
      "date": "2025-04-13T19:57:19.207",
      "type": "SmsMessageKind.received"
    },
    {
      "sender": "AE-AIRTEL",
      "body": "Hi, your transaction ID for Airtel Postpaid to Airtel Prepaid migration is  21-6351814053702. Please note, request will be completed within 30 minutes. Hope it helps - Team Airtel",
      "date": "2025-04-13T15:35:55.152",
      "type": "SmsMessageKind.received"
    },
    {
      "sender": "AE-AIRTEL",
      "body": "Hello Divyam Verma, we have registered the Request related to Account Updation on your Airtel Number 8881384839. Service Request No. 31-1000004190137, dated 13/04/2025. Rest assured, we will work on the same and get back to you with an update by 14/4/2025. Alternatively, you can also check the status of your Service Request on Airtel Thanks App: u.airtel.in/c_srtrck",
      "date": "2025-04-13T15:34:45.052",
      "type": "SmsMessageKind.received"
    },
    {
      "sender": "AD-AIRBIL",
      "body": "Hi Divyam Verma, \nWe have received a payment of Rs. 141.28 for your Airtel account. To download the payment receipt, click https://digi-api.airtel.in/raas/fetch?key=28d92c04fea32c4972d723f3a1d0c244e76852553b6147004148684ce3a537d7 This receipt will be available to download for 7-days only.",
      "date": "2025-04-13T15:34:18.462",
      "type": "SmsMessageKind.received"
    },
    {
      "sender": "AE-AIRINF",
      "body": "Hi, we have processed Rs. 141.28 for your Airtel Mobile 8881384839. The payment will be updated within 5 minutes. Please keep your order ID 7317125374395576320 for future reference. Track your payment status via  https://i.airtel.in/Recharge-Bills",
      "date": "2025-04-13T15:34:16.389",
      "type": "SmsMessageKind.received"
    },
    {
      "sender": "JA-JIOFBR",
      "body": "Dear Customer, \nYour JioFiber bill dated11-Apr-2025 for JioFixedVoice Number +918031639466 has been sent to your email ID divyamverma125@gmail.com. \nBill Summary : \nBill period : 11-Mar-2025 to 10-Apr-2025 \nTotal Amount payable : Rs. 470.82 \nPayment due date: 20-APR-2025 \nTo view your bill, click http://jio.com/my_bills.\nFor a step by step guide to help you easily understand your bill, click https://t.jio/JioFiber_BillGuide .\nTeam JioFiber",
      "date": "2025-04-13T11:14:28.527",
      "type": "SmsMessageKind.received"
    },
    {
      "sender": "AD-AIRTEL",
      "body": "Hi! Bill of Rs. 530 is due for payment on 16-APR-25 for your Airtel No. 8881384839 . Pay with ease from the comfort of your home using Airtel Thanks App i.airtel.in/PPpayBills or website www.airtel.in . Ignore if already paid.",
      "date": "2025-04-12T16:12:14.071",
      "type": "SmsMessageKind.received"
    },
    {
      "sender": "AD-AIRBIL",
      "body": "Hi Divyam Verma, \nWe have received a payment of Rs. 529.82 for your Airtel account. To download the payment receipt, click https://digi-api.airtel.in/raas/fetch?key=e60707d07af8ea6aa49c8e4f31986af6e5ee0bb6910a9ba4f0a418d0ef154b64 This receipt will be available to download for 7-days only.",
      "date": "2025-04-12T08:18:58.488",
      "type": "SmsMessageKind.received"
    },
    {
      "sender": "AE-AIRINF",
      "body": "Hi, we have processed Rs. 529.82 for your Airtel Mobile 8881384839. The payment will be updated within 5 minutes. Please keep your order ID 7316653433172303872 for future reference. Track your payment status via  https://i.airtel.in/Recharge-Bills",
      "date": "2025-04-12T08:18:57.379",
      "type": "SmsMessageKind.received"
    },
    {
      "sender": "VA-SBIUPI",
      "body": "Dear UPI user A/C X9855 debited by 529.82 on date 12Apr25 trf to Airtel Direct UP Refno 456073830493. If not u? call 1800111109. -SBI",
      "date": "2025-04-12T08:18:54.096",
      "type": "SmsMessageKind.received"
    },
    {
      "sender": "VA-SBIUPI",
      "body": "Dear UPI user A/C X9855 debited by 470.82 on date 12Apr25 trf to Jio Postpaid Bil Refno 471075359642. If not u? call 1800111109. -SBI",
      "date": "2025-04-12T08:17:57.839",
      "type": "SmsMessageKind.received"
    },
    {
      "sender": "JD-SBIUPI",
      "body": "Dear UPI user A/C X9855 debited by 260.0 on date 12Apr25 trf to Swiggy Limited Refno 223315289662. If not u? call 1800111109. -SBI",
      "date": "2025-04-12T08:15:52.118",
      "type": "SmsMessageKind.received"
    },
    {
      "sender": "VM-SxCIAL",
      "body": "Hey, SOCIAL missed your vibe! Come back for 50% OFF (up to Rs.1000). Great #eats & #drnks await. Valid till 13 Apr. Call 9152017971 to book! T&C.",
      "date": "2025-04-11T16:42:47.893",
      "type": "SmsMessageKind.received"
    },
    {
      "sender": "JK-SBIUPI",
      "body": "Dear User UPI LITE Top-up on SBI Rs.100.00 is successful. Ref No 828387204999. If not done by u, call 18001234 -SBI",
      "date": "2025-04-11T11:57:12.297",
      "type": "SmsMessageKind.received"
    },
    {
      "sender": "VA-CBSSBI",
      "body": "Dear Customer, Your A/C XXXXX869855 Credited. INR 9,005.00 on 10/04/25 on account of Closure of TD A/c XXXXX699725.-SBI",
      "date": "2025-04-10T12:25:43.030",
      "type": "SmsMessageKind.received"
    },
    {
      "sender": "VA-SBIUPI",
      "body": "Dear User UPI LITE Top-up on SBI Rs.100.00 is successful. Ref No 112880973724. If not done by u, call 18001234 -SBI",
      "date": "2025-04-10T12:00:55.924",
      "type": "SmsMessageKind.received"
    },
    {
      "sender": "VA-SBIUPI",
      "body": "Dear User UPI LITE Top-up on SBI Rs.100.00 is successful. Ref No 741119235378. If not done by u, call 18001234 -SBI",
      "date": "2025-04-08T11:47:41.900",
      "type": "SmsMessageKind.received"
    },
    {
      "sender": "JM-NSESMS",
      "body": "SBICAP SECURITIES LIMITED on 29-03-25 reported your Fund bal Rs.0 & Securities bal 0. This excludes your Bank, DP & PMS bal with the broker-NSE",
      "date": "2025-04-08T10:59:15.198",
      "type": "SmsMessageKind.received"
    },
    {
      "sender": "VD-PVRVIP",
      "body": "Tickets starting at INR 99! Don't miss Blockbuster Tuesday at PVR INOX. Hurry, valid only on 08 April. Book Now @ https://pvr.im/PVRVIP/PwDLMjLw. T&C Apply.",
      "date": "2025-04-08T10:48:42.715",
      "type": "SmsMessageKind.received"
    },
    {
      "sender": "JK-SBIUPI",
      "body": "Dear UPI user A/C X9855 debited by 2200.0 on date 07Apr25 trf to ZEPTO MARKETPLAC Refno 479777835433. If not u? call 1800111109. -SBI",
      "date": "2025-04-07T20:36:36.102",
      "type": "SmsMessageKind.received"
    },
    {
      "sender": "AD-AIRBIL",
      "body": "\nHi Divyam, Bill for your Airtel Mobile  8881384839 dated 06-APR-2025 has been generated.\nAmount to be paid: Rs 529.82\nDue Date: 16-APR-2025\nThis month's charges: Rs 529.82 (inclusive of tax) \n \nTo view your bill or to make payment, please visit https://i.airtel.in/PPBillbreakup\nTo understand your bill, click https://youtu.be/y1JoFufRp30\n",
      "date": "2025-04-06T02:30:15.352",
      "type": "SmsMessageKind.received"
    },
    {
      "sender": "JK-SBIUPI",
      "body": "Dear UPI user A/C X9855 debited by 357.2 on date 05Apr25 trf to BOOKMYSHOW Refno 971975516190. If not u? call 1800111109. -SBI",
      "date": "2025-04-05T20:39:17.229",
      "type": "SmsMessageKind.received"
    },
    {
      "sender": "JD-SBIUPI",
      "body": "Dear UPI user A/C X9855 debited by 823.0 on date 03Apr25 trf to EXPLOREX TECHNOL Refno 061376476813. If not u? call 1800111109. -SBI",
      "date": "2025-04-03T23:57:31.017",
      "type": "SmsMessageKind.received"
    },
    {
      "sender": "VA-SBIUPI",
      "body": "Dear User UPI LITE Top-up on SBI Rs.500.00 is successful. Ref No 164668764386. If not done by u, call 18001234 -SBI",
      "date": "2025-04-03T23:26:05.475",
      "type": "SmsMessageKind.received"
    },
    {
      "sender": "CP-QNTAMC",
      "body": "Dear Investor,Your purchase request Dt 02/04/2025 for Rs. 2499.88 in scheme quant Mid Cap Fund - Direct Plan is processed @ NAV of Rs. 229.4658 and 10.894 units are allotted in Folio: XXXXXXXX854 . Rgds, quant Mutual Fund.",
      "date": "2025-04-03T10:11:20.848",
      "type": "SmsMessageKind.received"
    },
    {
      "sender": "AX-QNTAMC",
      "body": "Dear Investor,Your purchase request Dt 02/04/2025 for Rs. 2499.88 in scheme quant Small Cap Fund - Direct Plan Growth is processed @ NAV of Rs. 249.5465 and 10.018 units are allotted in Folio: XXXXXXXX854 . Rgds, quant Mutual Fund.",
      "date": "2025-04-03T09:32:47.845",
      "type": "SmsMessageKind.received"
    },
    {
      "sender": "VM-ATMSBI",
      "body": "Dear Customer,you have done 2 out of 5 free transactions at Non-SBI ATM in India this month.Charges applicable beyond free transactions. Kindly use SBI ATM",
      "date": "2025-04-01T19:19:27.936",
      "type": "SmsMessageKind.received"
    },
    {
      "sender": "VA-ATMSBI",
      "body": "Dear Customer,you have done 1 out of 5 free transactions at Non-SBI ATM in India this month.Charges applicable beyond free transactions. Kindly use SBI ATM",
      "date": "2025-04-01T19:18:07.874",
      "type": "SmsMessageKind.received"
    },
    {
      "sender": "VA-ATMSBI",
      "body": "Dear SBI Customer, Rs.12000 withdrawn at SBI ATM S5NL040784623 from A/cX9855 on 01Apr25 Transaction Number 3639. Available Balance Rs.22024.92. If not withdrawn by you, forward this SMS to 7400165218 / call 1800111109 or 09449112211 to block your card. Call 18001234 if cash not received.",
      "date": "2025-04-01T19:12:25.506",
      "type": "SmsMessageKind.received"
    },
    {
      "sender": "VA-SBIUPI",
      "body": "Dear UPI user A/C X9855 debited by 366.0 on date 01Apr25 trf to Zerodha Broking Refno 904825163879. If not u? call 1800111109. -SBI",
      "date": "2025-04-01T16:33:28.948",
      "type": "SmsMessageKind.received"
    },
    {
      "sender": "VA-SBIPSG",
      "body": "Dear Customer, INR 40,000.00 credited to your A/c No XX9855 on 31/03/2025 through NEFT with UTR YESOB50911945756 by STATION91 TECHNOLOGIES PRIVATE LIMI, INFO: BATCHID:0077 SALARY MARCH 2025-SBI",
      "date": "2025-04-01T16:08:48.800",
      "type": "SmsMessageKind.received"
    },
    {
      "sender": "VM-SBIUPI",
      "body": "Dear UPI user A/C X9855 debited by 220.0 on date 29Mar25 trf to The Rameshwaram Refno 864923002856. If not u? call 1800111109. -SBI",
      "date": "2025-03-29T21:54:04.392",
      "type": "SmsMessageKind.received"
    },
    {
      "sender": "TX-SBIUPI",
      "body": "Dear User UPI LITE Top-up on SBI Rs.200.00 is successful. Ref No 261211590069. If not done by u, call 18001234 -SBI",
      "date": "2025-03-29T21:49:00.600",
      "type": "SmsMessageKind.received"
    },
    {
      "sender": "TX-CBSSBI",
      "body": "Your A/C XXXXX701850 Credited INR 11,000.00 on 29/03/25 -Deposit by transfer from Mr. DivyamVerma. Avl Bal INR 11,000.00-SBI",
      "date": "2025-03-29T20:53:23.361",
      "type": "SmsMessageKind.received"
    },
    {
      "sender": "VA-CBSSBI",
      "body": "Dear Customer, TDR/STDR No XXXXX701850 for INR 11,000.00 has been created on 29/03/25. Please submit form 15G/H, if eligible. Thank you for your patronage. Download YONO - SBI",
      "date": "2025-03-29T20:53:21.757",
      "type": "SmsMessageKind.received"
    },
    {
      "sender": "VA-CBSSBI",
      "body": "Your A/C XXXXX869855 Debited INR 11,000.00 on 29/03/25 -Transferred to Mr. DivyamVerma. Avl Balance INR 5,109.71-SBI",
      "date": "2025-03-29T20:53:15.683",
      "type": "SmsMessageKind.received"
    },
    {
      "sender": "VA-CBSSBI",
      "body": "Your A/C XXXXX869855 Credited INR 16,033.00 on 29/03/25 -Deposit by transfer from Mr. DivyamVerma. Avl Bal INR 16,109.71-SBI",
      "date": "2025-03-29T20:52:34.944",
      "type": "SmsMessageKind.received"
    },
    {
      "sender": "VA-CBSSBI",
      "body": "Dear Customer, Your A/C XXXXX869855 Credited. INR 16,033.00 on 29/03/25 on account of Closure of TD A/c XXXXX468888.-SBI",
      "date": "2025-03-29T20:52:32.992",
      "type": "SmsMessageKind.received"
    },
    {
      "sender": "TX-SBIUPI",
      "body": "Dear UPI user A/C X9855 debited by 40.0 on date 28Mar25 trf to The Rameshwaram Refno 957800433915. If not u? call 1800111109. -SBI",
      "date": "2025-03-28T23:36:45.286",
      "type": "SmsMessageKind.received"
    },
    {
      "sender": "TX-SBIUPI",
      "body": "Dear User UPI LITE Top-up on SBI Rs.100.00 is successful. Ref No 729621180220. If not done by u, call 18001234 -SBI",
      "date": "2025-03-27T11:29:10.898",
      "type": "SmsMessageKind.received"
    },
    {
      "sender": "TX-SBIUPI",
      "body": "Dear UPI user A/C X9855 debited by 40.0 on date 26Mar25 trf to The Rameshwaram Refno 783483441073. If not u? call 1800111109. -SBI",
      "date": "2025-03-26T23:18:26.354",
      "type": "SmsMessageKind.received"
    },
    {
      "sender": "CP-SxCIAL",
      "body": "Flat Rs.1000 off on 2500 @ SOCIAL! Watch the game tonight with epic #eats & #drnks. Bring your squad & cheer loud! Call 9152017971 to book a table. T&C.",
      "date": "2025-03-26T16:01:18.939",
      "type": "SmsMessageKind.received"
    },
    {
      "sender": "VM-SBIUPI",
      "body": "Dear UPI user A/C X9855 debited by 10.0 on date 25Mar25 trf to ABHISHEK PAREEK Refno 368557183526. If not u? call 1800111109. -SBI",
      "date": "2025-03-25T18:22:35.414",
      "type": "SmsMessageKind.received"
    },
    {
      "sender": "TX-SBIUPI",
      "body": "Dear UPI user A/C X9855 debited by 15.0 on date 25Mar25 trf to BMTC BUS KA57F03 Refno 206708833869. If not u? call 1800111109. -SBI",
      "date": "2025-03-25T12:10:12.066",
      "type": "SmsMessageKind.received"
    },
    {
      "sender": "TX-SBIUPI",
      "body": "Dear UPI user A/C X9855 debited by 143.0 on date 24Mar25 trf to Swiggy Limited Refno 902313310302. If not u? call 1800111109. -SBI",
      "date": "2025-03-24T19:22:41.912",
      "type": "SmsMessageKind.received"
    },
    {
      "sender": "VM-SBIUPI",
      "body": "Dear UPI user A/C X9855 debited by 10.0 on date 22Mar25 trf to KARNATAKA STORE Refno 683389871074. If not u? call 1800111109. -SBI",
      "date": "2025-03-22T20:16:17.428",
      "type": "SmsMessageKind.received"
    },
    {
      "sender": "JK-CBSSBI",
      "body": "Dear Customer, Your A/C XXXXX634420 has a debit by transfer of Rs 11,017.00 on 22/03/25. Avl Bal Rs 0.00.-SBI",
      "date": "2025-03-22T19:48:12.747",
      "type": "SmsMessageKind.received"
    },
    {
      "sender": "JM-CBSSBI",
      "body": "Your A/C XXXXX869855 Credited INR 11,017.00 on 22/03/25 -Deposit by transfer from Mr. DivyamVerma. Avl Bal INR 11,076.50-SBI",
      "date": "2025-03-22T19:48:03.070",
      "type": "SmsMessageKind.received"
    },
    {
      "sender": "JG-JIONET",
      "body": "Dear Customer, \nService request no SR000029T531 has been raised in your account. You will receive an update for this request by 22/03/2025 01:55. To track the status of your service requests at your convenience, please visit MyJio App - https://www.jio.com/track_sr_status",
      "date": "2025-03-21T01:55:23.743",
      "type": "SmsMessageKind.received"
    },
    {
      "sender": "CP-SxCIAL",
      "body": "The Insider advantage? 10% OFF on bills over Rs.1500, every time you visit SOCIAL. Scan the QR on your table and make it count! Call - 9152017971 .T&C.",
      "date": "2025-03-20T18:02:56.147",
      "type": "SmsMessageKind.received"
    },
    {
      "sender": "AD-SBIUPI",
      "body": "Dear UPI user A/C X9855 debited by 30.0 on date 20Mar25 trf to HALLI MANE DONNE Refno 322782378248. If not u? call 1800111109. -SBI",
      "date": "2025-03-20T12:48:20.529",
      "type": "SmsMessageKind.received"
    },
    {
      "sender": "VM-SBIUPI",
      "body": "Dear User UPI LITE Top-up on SBI Rs.100.00 is successful. Ref No 858898751729. If not done by u, call 18001234 -SBI",
      "date": "2025-03-20T01:15:14.652",
      "type": "SmsMessageKind.received"
    },
    {
      "sender": "JK-NSESMS",
      "body": "SBICAP SECURITIES LIMITED on 08-03-25 reported your Fund bal Rs.0 & Securities bal 0. This excludes your Bank, DP & PMS bal with the broker-NSE",
      "date": "2025-03-18T19:34:08.048",
      "type": "SmsMessageKind.received"
    },
    {
      "sender": "VM-SBIUPI",
      "body": "Dear UPI user A/C X9855 debited by 50.0 on date 18Mar25 trf to FOOD COURT Refno 748768062961. If not u? call 1800111109. -SBI",
      "date": "2025-03-18T14:12:28.767",
      "type": "SmsMessageKind.received"
    },
    {
      "sender": "CP-ZOMATO",
      "body": "Dear customer, your Zomato Credit balance of 25 is expiring tomorrow. Order now - http://zoma.to/ZOMATO/ap/xqzv/tzi80xlr -ZOMATO",
      "date": "2025-03-18T11:40:34.780",
      "type": "SmsMessageKind.received"
    },
    {
      "sender": "BX-SBYONO",
      "body": "Dear Customer, You have entered incorrect MPIN for first time and are left with 2 more attempts. Team YONO SBI",
      "date": "2025-03-17T14:07:43.256",
      "type": "SmsMessageKind.received"
    },
    {
      "sender": "VM-SBIUPI",
      "body": "Dear UPI user A/C X9855 debited by 80.0 on date 17Mar25 trf to HALLI MANE DONNE Refno 535118866092. If not u? call 1800111109. -SBI",
      "date": "2025-03-17T13:54:33.010",
      "type": "SmsMessageKind.received"
    },
    {
      "sender": "VA-SBIUPI",
      "body": "Dear SBI UPI User, ur A/cX9855 credited with Rs20 on 16Mar25 against reversal of txn (Ref no 632059235095)",
      "date": "2025-03-16T18:22:22.969",
      "type": "SmsMessageKind.received"
    },
    {
      "sender": "AD-AIRBIL",
      "body": "Hi Divyam Verma, \nWe have received a payment of Rs. 529.82 for your Airtel account. To download the payment receipt, click https://digi-api.airtel.in/raas/fetch?key=9bde89750581661e8300b715c1ddd0582ad04ea6fc9ecc982281ef99f5d95078 This receipt will be available to download for 7-days only.",
      "date": "2025-03-16T06:55:54.773",
      "type": "SmsMessageKind.received"
    },
    {
      "sender": "AE-AIRINF",
      "body": "Hi, we have processed Rs. 529.82 for your Airtel Mobile 8881384839. The payment will be updated within 5 minutes. Please keep your order ID 7306848032073244672 for future reference. Track your payment status via  https://i.airtel.in/Recharge-Bills",
      "date": "2025-03-16T06:55:52.427",
      "type": "SmsMessageKind.received"
    },
    {
      "sender": "AD-AIRTEL",
      "body": "Your payment for Airtel Mobile 8881384839 is due today! Please pay immediately to avoid late fee. You can visit Airtel Thanks App https://i.airtel.in/PPpayBills or www.airtel.in website to pay your bill. Please ignore if you have already paid.",
      "date": "2025-03-16T04:56:37.958",
      "type": "SmsMessageKind.received"
    },
    {
      "sender": "AD-AIRTEL",
      "body": "Hi! Bill of Rs. 530 is due for payment on 16-MAR-25 for your Airtel No. 8881384839 . Pay with ease from the comfort of your home using Airtel Thanks App i.airtel.in/PPpayBills or website www.airtel.in . Ignore if already paid.",
      "date": "2025-03-15T19:39:42.504",
      "type": "SmsMessageKind.received"
    },
    {
      "sender": "VM-SBIUPI",
      "body": "Dear UPI user A/C X9855 debited by 25.0 on date 13Mar25 trf to SANGITA DEVI WO Refno 501150011936. If not u? call 1800111109. -SBI",
      "date": "2025-03-13T20:56:38.877",
      "type": "SmsMessageKind.received"
    },
    {
      "sender": "JD-JIOFBR",
      "body": "Dear Customer, \nYour JioFiber bill dated11-Mar-2025 for JioFixedVoice Number +918031639466 has been sent to your email ID divyamverma125@gmail.com. \nBill Summary : \nBill period : 11-Feb-2025 to 10-Mar-2025 \nTotal Amount payable : Rs. 470.83 \nPayment due date: 20-MAR-2025 \nTo view your bill, click http://jio.com/my_bills.\nFor a step by step guide to help you easily understand your bill, click https://t.jio/JioFiber_BillGuide .\nTeam JioFiber",
      "date": "2025-03-13T15:47:06.921",
      "type": "SmsMessageKind.received"
    },
    {
      "sender": "AD-AIRTEL",
      "body": "Hi! Bill of Rs. 530 is due for payment on 16-MAR-25 for your Airtel No. 8881384839 . Pay with ease from the comfort of your home using Airtel Thanks App i.airtel.in/PPpayBills or website www.airtel.in . Ignore if already paid.",
      "date": "2025-03-13T00:18:00.497",
      "type": "SmsMessageKind.received"
    },
    {
      "sender": "VM-SBIUPI",
      "body": "Dear User UPI LITE Top-up on SBI Rs.200.00 is successful. Ref No 292181737827. If not done by u, call 18001234 -SBI",
      "date": "2025-03-12T20:09:47.598",
      "type": "SmsMessageKind.received"
    },
    {
      "sender": "JX-SBIUPI",
      "body": "Dear UPI user A/C X9855 debited by 148.95 on date 09Mar25 trf to ZEPTO MARKETPLAC Refno 923241409810. If not u? call 1800111109. -SBI",
      "date": "2025-03-09T19:52:30.008",
      "type": "SmsMessageKind.received"
    },
    {
      "sender": "VD-ZEPTON",
      "body": "Your payment for Zepto order 96ED5BPLO74457 was not completed. Any amount if debited will get refunded within 2-3 days. Please try placing the order again.",
      "date": "2025-03-09T19:52:02.415",
      "type": "SmsMessageKind.received"
    },
    {
      "sender": "AD-SBIUPI",
      "body": "Dear UPI user A/C X9855 debited by 357.0 on date 09Mar25 trf to GITARTHA  KASHYA Refno 541728391065. If not u? call 1800111109. -SBI",
      "date": "2025-03-09T17:39:41.980",
      "type": "SmsMessageKind.received"
    },
    {
      "sender": "JK-620016",
      "body": " Jio  8299068351        |   Rs.299        , 1.5 GB    28    |      www.jio.com/r/AIIG7HxUz |    ",
      "date": "2025-03-09T14:50:04.431",
      "type": "SmsMessageKind.received"
    },
    {
      "sender": "JK-NSESMS",
      "body": "SBICAP SECURITIES LIMITED on 01-03-25 reported your Fund bal Rs.0 & Securities bal 0. This excludes your Bank, DP & PMS bal with the broker-NSE",
      "date": "2025-03-09T01:16:03.124",
      "type": "SmsMessageKind.received"
    },
    {
      "sender": "VA-EASEBZ",
      "body": "Dear Customer, Thank you for making a successful transaction. Your transaction with TXN ID: E2503080DSE6CG has been successfully processed. Your amount deducted is Rs. 142.54 \n-Easebuzz",
      "date": "2025-03-08T21:34:17.727",
      "type": "SmsMessageKind.received"
    },
    {
      "sender": "JX-620016",
      "body": " Jio  8299068351        |   Rs.299        , 1.5 GB    28    |      www.jio.com/r/AInkBICoi |    ",
      "date": "2025-03-08T11:34:49.201",
      "type": "SmsMessageKind.received"
    },
    {
      "sender": "VM-GKKWIK",
      "body": "Payment requested: Nobero - Live has requested a payment of INR 599.00 on Gokwik. Click here to complete the payment: https://kwik.pe/GKKWIK/PXNfPs",
      "date": "2025-03-07T21:23:27.546",
      "type": "SmsMessageKind.received"
    },
    {
      "sender": "JD-620016",
      "body": " Jio  8299068351        |   Rs.299        , 1.5 GB    28    |      www.jio.com/r/AH217ucFd |    ",
      "date": "2025-03-07T13:32:20.344",
      "type": "SmsMessageKind.received"
    },
    {
      "sender": "JK-620016",
      "body": " Jio  8299068351        |   Rs.299        , 1.5 GB    28    |      www.jio.com/r/AHGLqbLyc |    ",
      "date": "2025-03-06T11:58:38.006",
      "type": "SmsMessageKind.received"
    },
    {
      "sender": "AD-AIRBIL",
      "body": "\nHi Divyam, Bill for your Airtel Mobile  8881384839 dated 06-MAR-2025 has been generated.\nAmount to be paid: Rs 529.82\nDue Date: 16-MAR-2025\nThis month's charges: Rs 529.82 (inclusive of tax) \n \nTo view your bill or to make payment, please visit https://i.airtel.in/PPBillbreakup\nTo understand your bill, click https://youtu.be/y1JoFufRp30\n",
      "date": "2025-03-06T05:32:50.787",
      "type": "SmsMessageKind.received"
    },
    {
      "sender": "JD-620016",
      "body": " Jio  8299068351        |   Rs.299        , 1.5 GB    28    |      www.jio.com/r/AHnn5Y51M |    ",
      "date": "2025-03-05T12:09:18.146",
      "type": "SmsMessageKind.received"
    },
    {
      "sender": "VM-QNTAMC",
      "body": "Dear Investor,Your purchase request Dt 04/03/2025 for Rs. 4999.75 in scheme quant Mid Cap Fund - Direct Plan is processed @ NAV of Rs. 208.1479 and 24.020 units are allotted in Folio: XXXXXXXX854 . Rgds, quant Mutual Fund.",
      "date": "2025-03-05T10:09:00.814",
      "type": "SmsMessageKind.received"
    },
    {
      "sender": "JK-CBSSBI",
      "body": "Your A/C XXXXX468888 Credited INR 16,000.00 on 04/03/25 -Deposit by transfer from Mr. DivyamVerma. Avl Bal INR 16,000.00-SBI",
      "date": "2025-03-04T12:34:03.217",
      "type": "SmsMessageKind.received"
    },
    {
      "sender": "VM-CBSSBI",
      "body": "Your A/C XXXXX869855 Debited INR 16,000.00 on 04/03/25 -Transferred to Mr. DivyamVerma. Avl Balance INR 10,428.20-SBI",
      "date": "2025-03-04T12:34:01.016",
      "type": "SmsMessageKind.received"
    },
    {
      "sender": "JK-620016",
      "body": " Jio  8299068351        |   Rs.299        , 1.5 GB    28    |      www.jio.com/r/AG1U4sljH |    ",
      "date": "2025-03-04T11:15:20.559",
      "type": "SmsMessageKind.received"
    },
    {
      "sender": "VK-ATMSBI",
      "body": "Dear Customer,you have done 1 out of 5 free transactions at Non-SBI ATM in India this month.Charges applicable beyond free transactions. Kindly use SBI ATM",
      "date": "2025-03-04T10:55:42.696",
      "type": "SmsMessageKind.received"
    },
    {
      "sender": "VM-CBSSBI",
      "body": "Dear Customer, TDR/STDR No XXXXX634420 for INR 11,000.00 has been created on 03/03/25. Please submit form 15G/H, if eligible. Thank you for your patronage. Download YONO - SBI",
      "date": "2025-03-03T14:47:41.102",
      "type": "SmsMessageKind.received"
    },
    {
      "sender": "VK-CBSSBI",
      "body": "Your A/C XXXXX869855 Debited INR 11,000.00 on 03/03/25 -Transferred to Mr. DivyamVerma. Avl Balance INR 38,571.98-SBI",
      "date": "2025-03-03T14:47:34.700",
      "type": "SmsMessageKind.received"
    },
    {
      "sender": "JK-620016",
      "body": " Jio  8299068351        |   Rs.299        , 1.5 GB    28    |      www.jio.com/r/AGG0lKYgc |    ",
      "date": "2025-03-03T11:38:21.790",
      "type": "SmsMessageKind.received"
    },
    {
      "sender": "VM-SBIUPI",
      "body": "Dear UPI user A/C X9855 debited by 2500.0 on date 03Mar25 trf to Sonam  Verma Refno 544324056982. If not u? call 1800111109. -SBI",
      "date": "2025-03-03T10:42:45.008",
      "type": "SmsMessageKind.received"
    },
    {
      "sender": "VK-SBIPSG",
      "body": "Dear Customer, INR 40,000.00 credited to your A/c No XX9855 on 03/03/2025 through NEFT with UTR YESOB50621279645 by STATION91 TECHNOLOGIES PRIVATE LIMI, INFO: BATCHID:0008 SALARY FEB 2025-SBI",
      "date": "2025-03-03T05:00:29.909",
      "type": "SmsMessageKind.received"
    },
    {
      "sender": "JM-620016",
      "body": " Jio  8299068351        |   Rs.299        , 1.5 GB    28    |      www.jio.com/r/AGlNZt6iH |    ",
      "date": "2025-03-02T14:06:38.715",
      "type": "SmsMessageKind.received"
    },
    {
      "sender": "VD-axioFS",
      "body": "Pay axio Pay Later bill of Rs3741 by 5th of this month: https://u.axio.co/axo/Tz6YtFtvvhvt4B\nBill: https://u.axio.co/axo/uZNj5ouSuaKIV\naxio",
      "date": "2025-03-02T12:08:41.838",
      "type": "SmsMessageKind.received"
    },
    {
      "sender": "JD-620016",
      "body": " Jio  8299068351        |   Rs.299        , 1.5 GB    28    |      www.jio.com/r/AFZasg5N9 |    ",
      "date": "2025-03-01T11:49:47.071",
      "type": "SmsMessageKind.received"
    },
    {
      "sender": "JX-620016",
      "body": " Jio  8299068351        |   Rs.299        , 1.5 GB    28    |      www.jio.com/r/AFDLqpQeq |    ",
      "date": "2025-02-28T11:54:06.447",
      "type": "SmsMessageKind.received"
    },
    {
      "sender": "AD-AIRTEL",
      "body": "Wave goodbye to late fees! With Airtel Postpaid autopay, bills pay themselves on time, every time. Set it up here i.airtel.in/pppay2",
      "date": "2025-02-27T17:44:52.114",
      "type": "SmsMessageKind.received"
    },
    {
      "sender": "VK-SBIUPI",
      "body": "Dear User UPI LITE Top-up on SBI Rs.1987.06 is successful. Ref No 667628056013. If not done by u, call 18001234 -SBI",
      "date": "2025-02-27T12:13:35.011",
      "type": "SmsMessageKind.received"
    },
    {
      "sender": "JM-620016",
      "body": " Jio  8299068351        |   Rs.299        , 1.5 GB    28    |      www.jio.com/r/AFh1c8mKW |    ",
      "date": "2025-02-27T11:51:28.204",
      "type": "SmsMessageKind.received"
    },
    {
      "sender": "VM-GKKWIK",
      "body": "Payment requested: NAKPRO NUTRITION has requested a payment of INR 1069.72 on Gokwik. Click here to complete the payment: https://kwik.pe/GKKWIK/bh0DCZ",
      "date": "2025-02-27T00:32:36.032",
      "type": "SmsMessageKind.received"
    },
    {
      "sender": "JD-620016",
      "body": " Jio  8299068351        |   Rs.299        , 1.5 GB    28    |      www.jio.com/r/AEYTPTOt8 |    ",
      "date": "2025-02-26T12:36:31.845",
      "type": "SmsMessageKind.received"
    },
    {
      "sender": "VM-SBIUPI",
      "body": "Dear UPI user A/C X9855 debited by 40.0 on date 26Feb25 trf to KARNATAKA STORE Refno 264177241412. If not u? call 1800111109. -SBI",
      "date": "2025-02-26T10:35:54.907",
      "type": "SmsMessageKind.received"
    },
    {
      "sender": "VM-SBIUPI",
      "body": "Dear UPI user A/C X9855 debited by 266.11 on date 26Feb25 trf to zeptonow Refno 169569234352. If not u? call 1800111109. -SBI",
      "date": "2025-02-26T10:18:11.385",
      "type": "SmsMessageKind.received"
    },
    {
      "sender": "JM-620016",
      "body": " Jio  8299068351        |   Rs.299        , 1.5 GB    28    |      www.jio.com/r/AEExEHYUS |    ",
      "date": "2025-02-25T11:50:38.194",
      "type": "SmsMessageKind.received"
    },
    {
      "sender": "JD-620016",
      "body": " Jio  8299068351        |   Rs.299        , 1.5 GB    28    |      www.jio.com/r/AEjU56NVz |    ",
      "date": "2025-02-24T12:24:56.089",
      "type": "SmsMessageKind.received"
    },
    {
      "sender": "JD-SBIUPI",
      "body": "Dear User UPI LITE Top-up on SBI Rs.20.00 is successful. Ref No 203997016313. If not done by u, call 18001234 -SBI",
      "date": "2025-02-24T11:59:11.558",
      "type": "SmsMessageKind.received"
    },
    {
      "sender": "AD-SBIUPI",
      "body": "Your UPI-Mandate is successfully cancelled towards Google for 175.00 from A/c No.XXXXXX9855. UMN:84f32b6c4c74492c88898efd79188548@ibl -SBI",
      "date": "2025-02-24T01:55:32.344",
      "type": "SmsMessageKind.received"
    },
    {
      "sender": "AD-SBIUPI",
      "body": "Your UPI-Mandate is successfully cancelled towards CRUNCHYROLL INDIA PRIVATE LIMITED for 99.00 from A/c No.XXXXXX9855. UMN:7d2b5b48c7a84a209b867ac36e8055c8@ibl -SBI",
      "date": "2025-02-24T01:53:25.150",
      "type": "SmsMessageKind.received"
    },
    {
      "sender": "JD-620016",
      "body": " Jio  8299068351        |   Rs.299        , 1.5 GB    28    |      www.jio.com/r/AD0B1wEbk |    ",
      "date": "2025-02-23T12:18:45.883",
      "type": "SmsMessageKind.received"
    },
    {
      "sender": "JK-NSESMS",
      "body": "SBICAP SECURITIES LIMITED on 15-02-25 reported your Fund bal Rs.0 & Securities bal 0. This excludes your Bank, DP & PMS bal with the broker-NSE",
      "date": "2025-02-23T06:21:38.104",
      "type": "SmsMessageKind.received"
    },
    {
      "sender": "JD-SBIUPI",
      "body": "Dear UPI User, UPI AutoPay for Google debit of Rs.299.00 is scheduled on .24/02/25, d7afa160595246e3831af810382ac6b7@ibl. Please ensure sufficient balance in your account. -SBI",
      "date": "2025-02-22T22:47:28.084",
      "type": "SmsMessageKind.received"
    },
    {
      "sender": "JK-620016",
      "body": " Jio  8299068351        |   Rs.299        , 1.5 GB    28    |      www.jio.com/r/ADE6xHlKh |    ",
      "date": "2025-02-22T12:47:53.493",
      "type": "SmsMessageKind.received"
    },
    {
      "sender": "JM-620016",
      "body": " Jio  8299068351        |   Rs.299        , 1.5 GB    28    |      www.jio.com/r/ADkxn0sGS |    ",
      "date": "2025-02-21T12:01:43.780",
      "type": "SmsMessageKind.received"
    },
    {
      "sender": "JD-620016",
      "body": " Jio  8299068351        |   Rs.299        , 1.5 GB    28    |      www.jio.com/r/AC0pFZWnf |    ",
      "date": "2025-02-20T12:27:10.305",
      "type": "SmsMessageKind.received"
    },
    {
      "sender": "TM-ITDCPC",
      "body": "Total TDS by Employer of PAN AQYXXXXX4L for Qtr ending Dec 31 is Rs 30,000 and cumulative TDS for FY 24-25 is Rs 90,000. View 26AS/ATS for details. ITD Team",
      "date": "2025-02-19T20:41:45.288",
      "type": "SmsMessageKind.received"
    },
    {
      "sender": "JD-620016",
      "body": " Jio  8299068351        |   Rs.299        , 1.5 GB    28    |      www.jio.com/r/ACH6WCFxF |    ",
      "date": "2025-02-19T12:26:05.478",
      "type": "SmsMessageKind.received"
    },
    {
      "sender": "JM-620016",
      "body": " Jio  8299068351        |   Rs.299        , 1.5 GB    28    |      www.jio.com/r/AB3467cdp |    ",
      "date": "2025-02-17T12:26:53.988",
      "type": "SmsMessageKind.received"
    },
    {
      "sender": "JK-620016",
      "body": " Jio  8299068351        |   Rs.299        , 1.5 GB    28    |      www.jio.com/r/ABJg7xUjU |    ",
      "date": "2025-02-16T12:19:12.070",
      "type": "SmsMessageKind.received"
    },
    {
      "sender": "JD-EASEBZ",
      "body": "Dear Customer, Thank you for making a successful transaction. Your transaction with TXN ID: E2502160D9UB0C has been successfully processed. Your amount deducted is Rs. 258.72 \n-Easebuzz",
      "date": "2025-02-16T00:47:19.799",
      "type": "SmsMessageKind.received"
    },
    {
      "sender": "BR-SBIUPI",
      "body": "Dear User UPI LITE Top-up on SBI Rs.100.00 is successful. Ref No 398890028233. If not done by u, call 18001234 -SBI",
      "date": "2025-02-15T19:10:57.898",
      "type": "SmsMessageKind.received"
    },
    {
      "sender": "JD-620016",
      "body": " Jio  8299068351        |   Rs.299        , 1.5 GB    28    |      www.jio.com/r/ABommB0eM |    ",
      "date": "2025-02-15T11:26:19.062",
      "type": "SmsMessageKind.received"
    },
    {
      "sender": "CP-ZEPTON",
      "body": "Surprise your loved one with fresh roses, starting at Rs. 49. Order today and spread the Valentine's cheer! https://s.zepto.co.in/tC90/fts",
      "date": "2025-02-14T17:12:41.961",
      "type": "SmsMessageKind.received"
    },
    {
      "sender": "JK-620016",
      "body": " Jio  8299068351        |   Rs.299        , 1.5 GB    28    |      www.jio.com/r/AA3prUEdv |    ",
      "date": "2025-02-14T12:13:12.649",
      "type": "SmsMessageKind.received"
    },
    {
      "sender": "CP-ZEPTON",
      "body": "Sparkle this Valentine's Day! Earrings from just Rs. 99 at Zepto. Get an extra 15% off with code TRYFASHION15. Shop now: https://s.zepto.co.in/tC90/fts",
      "date": "2025-02-14T09:05:36.761",
      "type": "SmsMessageKind.received"
    },
    {
      "sender": "JM-620016",
      "body": " Jio  8299068351        |   Rs.299        , 1.5 GB    28    |      www.jio.com/r/AAJBNryyF |    ",
      "date": "2025-02-13T13:18:21.725",
      "type": "SmsMessageKind.received"
    },
    {
      "sender": "CP-SxCIAL",
      "body": "Double the sips, double the love! Celebrate Valentine's @ SOCIAL with 1+1 on #drnks & 2+2 on beers till 23rd Feb. Call 9152017971 to book! T&C apply.",
      "date": "2025-02-13T13:00:55.037",
      "type": "SmsMessageKind.received"
    },
    {
      "sender": "JK-SBIUPI",
      "body": "Dear UPI user A/C X9855 debited by 10.0 on date 13Feb25 trf to SRI MANDHAPPA ST Refno 678648962434. If not u? call 1800111109. -SBI",
      "date": "2025-02-13T07:48:24.565",
      "type": "SmsMessageKind.received"
    },
    {
      "sender": "JZ-JIOFBR",
      "body": "Dear Customer, \nYour JioFiber bill dated11-Feb-2025 for JioFixedVoice Number +918031639466 has been sent to your email ID divyamverma125@gmail.com. \nBill Summary : \nBill period : 11-Jan-2025 to 10-Feb-2025 \nTotal Amount payable : Rs. 470.82 \nPayment due date: 20-FEB-2025 \nTo view your bill, click http://jio.com/my_bills.\nFor a step by step guide to help you easily understand your bill, click https://t.jio/JioFiber_BillGuide .\nTeam JioFiber",
      "date": "2025-02-13T02:59:54.123",
      "type": "SmsMessageKind.received"
    },
    {
      "sender": "JX-620016",
      "body": " Jio  8299068351        |   Rs.299        , 1.5 GB    28    |      www.jio.com/r/AApRTtuF6 |    ",
      "date": "2025-02-12T11:19:51.830",
      "type": "SmsMessageKind.received"
    },
    {
      "sender": "JK-620016",
      "body": " Jio  8299068351        |   Rs.299        , 1.5 GB    28    |      www.jio.com/r/Az5Y1qAVH |    ",
      "date": "2025-02-11T12:08:07.419",
      "type": "SmsMessageKind.received"
    },
    {
      "sender": "JK-620016",
      "body": " Jio  8299068351        |   Rs.299        , 1.5 GB    28    |      www.jio.com/r/AzKZk2gNI |    ",
      "date": "2025-02-10T12:10:53.534",
      "type": "SmsMessageKind.received"
    },
    {
      "sender": "JK-SBIUPI",
